_id,title,top_image,images,videos,url,date,short_description,text,publisher
65e26ce965be8c6f9d99ed57,Haley says US will have 'female president' — either herself or Kamala Harris,https://static.foxnews.com/foxnews.com/content/uploads/2024/02/Nikki-Haley-Beaufort-SC-Feb.-21-2024-e1708697418885.jpg,"['https://a57.foxnews.com/static.foxnews.com/foxnews.com/content/uploads/2024/02/1200/675/Nikki-Haley-Beaufort-SC-Feb.-21-2024-e1708697418885.jpg?ve=1&tl=1', 'https://a57.foxnews.com/static.foxnews.com/foxnews.com/content/uploads/2023/12/348/196/GettyImages-1845420889.jpg?ve=1&tl=1', 'https://a57.foxnews.com/static.foxnews.com/foxnews.com/content/uploads/2024/02/348/196/missouri_legislature.jpg?ve=1&tl=1', 'https://a57.foxnews.com/static.foxnews.com/foxnews.com/content/uploads/2024/02/1200/675/Trump.jpg?ve=1&tl=1', 'https://static.foxnews.com/foxnews.com/content/uploads/2022/11/NEWSLETTER_POLITICS-532x120.png', 'https://a57.foxnews.com/static.foxnews.com/foxnews.com/content/uploads/2024/02/348/196/iamanallypg23.jpg?ve=1&tl=1', 'https://a57.foxnews.com/static.foxnews.com/foxnews.com/content/uploads/2024/02/1200/675/Kamala-Harris-Orangeburg-S.C.-Feb.-2-2024.jpg?ve=1&tl=1', 'https://a57.foxnews.com/cf-images.us-east-1.prod.boltdns.net/v1/static/694940094001/b3ab6f14-9839-4355-8e1b-d8c96c07a2ac/422aba73-38bc-44f0-9293-82cd9edf60fc/1280x720/match/896/500/image.jpg?ve=1&tl=1', 'https://a57.foxnews.com/static.foxnews.com/foxnews.com/content/uploads/2024/02/348/196/Biden-Judd.jpg?ve=1&tl=1', 'https://static.foxnews.com/foxnews.com/content/uploads/2024/02/Nikki-Haley-Beaufort-SC-Feb.-21-2024-e1708697418885.jpg']",[],https://www.foxnews.com/politics/haley-2024-female-president-either-herself-kamala-harris,2024-02-23,Haley says US will have 'female president' — either herself or Kamala Harris  Fox News,"Join Fox News for access to this content Plus special access to select articles and other premium content with your account - free of charge. Please enter a valid email address.

Republican presidential candidate Nikki Haley says that there is going to be a female president soon — either herself or Vice President Kamala Harris.

Haley made the remarks during a Thursday interview on CNN with anchor Jake Tapper.

""Donald Trump will not win the general election,"" Haley told Tapper. ""You can have him win any primary you want, he will not win a general election.""

HALEY ON WHETHER TRUMP WILL CLINCH REPUBLICAN PRESIDENTIAL NOMINATION NEXT MONTH: 'LET'S SEE IF IT HAPPENS'

""We will have a female President of the United States, it will either be me or it will be [Vice President Kamala] Harris.""

Haley's comments seem to indicate she believes President Biden will either not stand for re-election or will not be able to complete his term, turning the Oval Office over to Harris.

Haley, who is trailing Trump significantly in her home state of South Carolina, has not yet won a Republican primary.

TRUMP CAMPAIGN PREDICTS ‘A**-KICKING' FOR HALEY IN HER HOME STATE, BUT SHE SAYS ‘I REFUSE TO QUIT’

Regardless, the former U.N. ambassador asserts that she is the only viable candidate in the general election.

""If Donald Trump is the nominee, you can mark my words, he will not win a general election,"" Haley said in the interview.

Haley has repeatedly pledged to stay in the Republican presidential nomination race at least through March 5, when 15 states hold contests on Super Tuesday.

CLICK HERE TO GET THE FOX NEWS APP

She faces an extremely steep uphill climb to win the nomination against the former president, who remains the commanding frontrunner in the GOP race as he bids a third straight time for the White House.

""We are focused on every state before us. Now it’s South Carolina on Saturday. Then it will be Michigan, then it will be Super Tuesday states, and we’ll take it from there,"" Haley told Fox News Digital interview on Wednesday.

Fox News Digital's Paul Steinhauser contributed to this report.","{'href': 'https://www.foxnews.com', 'title': 'Fox News'}"
65e26ce965be8c6f9d99ed58,Lloyd Austin to face grilling from lawmakers over secret hospital visits,https://static.foxnews.com/foxnews.com/content/uploads/2024/01/AP24029562628515.jpg,"['https://a57.foxnews.com/static.foxnews.com/foxnews.com/content/uploads/2023/07/348/196/Donald-Trump.jpg?ve=1&tl=1', 'https://a57.foxnews.com/static.foxnews.com/foxnews.com/content/uploads/2024/01/1200/675/pentagon.jpg?ve=1&tl=1', 'https://a57.foxnews.com/static.foxnews.com/foxnews.com/content/uploads/2024/02/348/196/Schweizer-AOCbillboard.jpg?ve=1&tl=1', 'https://a57.foxnews.com/static.foxnews.com/foxnews.com/content/uploads/2024/01/1200/675/AP24029562628515.jpg?ve=1&tl=1', 'https://static.foxnews.com/foxnews.com/content/uploads/2022/11/NEWSLETTER_POLITICS-532x120.png', 'https://a57.foxnews.com/static.foxnews.com/foxnews.com/content/uploads/2024/02/348/196/AP24058604121910.jpg?ve=1&tl=1', 'https://a57.foxnews.com/static.foxnews.com/foxnews.com/content/uploads/2024/01/1200/675/AP23352618252561.jpg?ve=1&tl=1', 'https://a57.foxnews.com/static.foxnews.com/foxnews.com/content/uploads/2024/01/348/196/GettyImages-1975808352.jpg?ve=1&tl=1', 'https://static.foxnews.com/foxnews.com/content/uploads/2024/01/AP24029562628515.jpg', 'https://a57.foxnews.com/cf-images.us-east-1.prod.boltdns.net/v1/static/694940094001/948cb9a3-42ce-4b16-b842-b221773b2c50/6bc3dfa4-6ee1-4fb5-b24a-128161a5fe53/1280x720/match/896/500/image.jpg?ve=1&tl=1']",[],https://www.foxnews.com/politics/lloyd-austin-face-grilling-lawmakers-secret-hospital-visits,2024-02-29,Lloyd Austin to face grilling from lawmakers over secret hospital visits  Fox News,"Join Fox News for access to this content Plus special access to select articles and other premium content with your account - free of charge. Please enter a valid email address.

Secretary of Defense Lloyd Austin will face a grilling from lawmakers in his first appearance before Congress since his secretive hospital visits in January.

Austin will appear before the GOP-controlled House Armed Services Committee. Several lawmakers on the committee have blasted the secretary both for not informing Congress of his days-long hospital visit, but also for keeping President Biden in the dark.

Lawmakers are concerned the secretive move could have caused a breakdown in the chain of command stretching from the White House to the Pentagon. While Austin insists he transferred authority to a secretary during his hospital visit, concerns remain given he informed none of his superiors of the move.

Austin's frequent hospital visits come thanks to a prostate cancer diagnosis, which he received in December. The offending hospital visit came on January 1, when he was taken to Walter Reed National Military Medical Center via ambulance. He was soon transferred to intensive care.

FATHERS, UNCLE OF MARINES KILLED IN CALIFORNIA HELICOPTER CRASH SPEAK OUT: ‘SHOULD NOT HAVE HAPPENED’

MARINE KILLED IN CAMP PENDLETON TRAINING EXERCISE IDENTIFIED

The Pentagon came under a barrage of criticism Monday following the release of an internal review of its handling of Austin's hospitalization.

The review, carried out by Austin's subordinates , largely absolves anyone of wrongdoing for the secrecy surrounding the incident. The review states flatly that there was ""no indication of ill intent or an attempt to obfuscate.""

Pentagon press secretary Maj. Gen. Patrick Ryder told reporters that Secretary Austin’s staff decided to transfer authority to Deputy Defense Secretary Kathleen Hicks on January 2 as he was in the ICU. He said the secretary was never unconscious, though it remained unclear why his staff made that call.

DOJ SAYS MERRICK GARLAND TO TRANSFER POWER DURING UPCOMING BACK SURGERY AFTER BIDEN DEFENSE DEPT CONTROVERSY

Hicks, meanwhile, was on vacation in Puerto Rico and did not learn of Austin’s hospitalization until three days later, after he was transported to the ICU.

Austin's remarks before the House Committee are likely to mirror the public apology he gave over the incident in early February. He said he personally apologized to Biden as well.

CLICK HERE TO GET THE FOX NEWS APP

""I want to be crystal clear. We did not handle this right and I did not handle this right,"" Austin said at the time. ""I should have told the president about my cancer diagnosis. I should have also told my team and the American public, and I take full responsibility. I apologize to my teammates and to the American people.""","{'href': 'https://www.foxnews.com', 'title': 'Fox News'}"
65e26ce965be8c6f9d99ed59,Key witness in Fani Willis case testifies he may have lied in texts about friends' affair,https://static.foxnews.com/foxnews.com/content/uploads/2024/02/willis.jpg,"['https://a57.foxnews.com/static.foxnews.com/foxnews.com/content/uploads/2024/02/348/196/hunter_biden_deposition_getty.jpg?ve=1&tl=1', 'https://a57.foxnews.com/static.foxnews.com/foxnews.com/content/uploads/2023/11/348/196/Just-Stop-Oil-compilation.jpg?ve=1&tl=1', 'https://a57.foxnews.com/cf-images.us-east-1.prod.boltdns.net/v1/static/694940094001/195b12f3-bcd0-406e-b6e7-0c18bda40be7/1a20ce17-92af-4f17-8889-af42974babab/1280x720/match/720/405/image.jpg?ve=1&tl=1', 'https://a57.foxnews.com/static.foxnews.com/foxnews.com/content/uploads/2024/02/348/196/AP24059679895953.jpg?ve=1&tl=1', 'https://static.foxnews.com/foxnews.com/content/uploads/2024/02/willis.jpg', 'https://static.foxnews.com/foxnews.com/content/uploads/2022/11/NEWSLETTER_POLITICS-532x120.png', 'https://a57.foxnews.com/cf-images.us-east-1.prod.boltdns.net/v1/static/694940094001/cffb722a-0b42-410c-be68-7fd5a03e3811/9d7d2279-03e3-48de-9973-25478a08c762/1280x720/match/896/500/image.jpg?ve=1&tl=1', 'https://a57.foxnews.com/static.foxnews.com/foxnews.com/content/uploads/2024/02/1200/675/Fani-Willis-Nathan-Wade.jpg?ve=1&tl=1', 'https://a57.foxnews.com/static.foxnews.com/foxnews.com/content/uploads/2024/02/1200/675/willis.jpg?ve=1&tl=1', 'https://a57.foxnews.com/static.foxnews.com/foxnews.com/content/uploads/2024/02/1200/675/GettyImages-2036328740.jpg?ve=1&tl=1', 'https://a57.foxnews.com/static.foxnews.com/foxnews.com/content/uploads/2023/02/348/196/Biden.jpg?ve=1&tl=1']",[],https://www.foxnews.com/politics/key-witness-in-fani-wilis-case-testifies-he-may-have-lied-in-texts-about-friends-affair,2024-02-27,Key witness in Fani Willis case testifies he may have lied in texts about friends' affair  Fox News,"Join Fox News for access to this content Plus special access to select articles and other premium content with your account - free of charge. Please enter a valid email address.

Former law firm partner and divorce attorney Terrance Bradley on Tuesday testified under oath regarding what he knew about Fulton County, Georgia, District Attorney Fani Willis and special prosector Nathan Wade's personal relationship. Bradley took the stand after Judge Scott McAfee determined Bradley couldn't claim attorney-client privilege.

Bradley, when pressed under oath, said he couldn't recall several details and timelines about conversations he had with former client Wade about Wade's romantic relationship with Willis.

Defense attorney Ashleigh Merchant at one point referenced text messages between her and Bradley in which she had asked Bradley if he thought the relationship started before Willis hired Wade in 2021. Bradley responded ""absolutely"" in the text exchange.

When confronted with a record of those texts in court Tuesday, Bradley appeared to mutter ""dang."" But then he said he was ""speculating"" in those comments.

FANI WILLIS’ TESTIMONY WAS ‘BELLIGERENT’ AND COULD DAMAGE HER CREDIBILITY, FORMER PROSECUTOR SAYS

Attorney Richard Rice later asked Bradley if he makes a habit of passing on ""lies about your friends.""

""Do you tell lies about your friends? About a case of national importance?"" Rice asked.

""I could have had, I don't know,"" Bradley responded.

Bradely said he couldn't recall key details or specific information more than two dozen times in the roughly two-hour testimony in Fulton County Superior Court on Tuesday. He also said he had only ever discussed Wade's relationship with Willis once with Wade.

FULTON COUNTY DA FANI WILLIS ACCUSED OF LYING ABOUT TIMING OF AFFAIR WITH TRUMP PROSECUTOR

Bradley this month avoided answering certain questions, citing attorney-client privilege. McAfee said he would hold an ""in-camera"" meeting with Bradley to determine if his privilege assertions are accurate. He said it appeared that Bradley may have been misusing his attorney-client privilege.

Bradley is the former law firm partner of Wade, who is accused of having an affair that financially benefited Willis after she hired him to help prosecute the election interference case against former President Donald Trump.

On Tuesday, Bradley said he hadn't spoken to Wade in two years after having been friends for more than 10 years.

Bradley had refused to answer some of the questions asked by defense counsel about what he knew about Wade and Willis’ relationship and when he knew, citing attorney-client privilege. Bradley, for a brief time, was Wade’s lawyer during Wade's divorce.

McAfee determined after the in-camera meeting that Bradley's testimony was not covered by privilege, leading to Tuesday's testimony, which is likely the last installment of evidentiary hearings before both sides present final arguments Friday.

Lawyers for Trump and his co-defendants who are accusing Willis of having had an ""improper"" affair with Wade will try to connect evidence that Willis and Wade lied about when their relationship began and should therefore be disqualified from the case.

Earlier this month, Willis' father, John C. Floyd III, took the stand and confirmed what Willis testified to — that her father taught her to keep large amounts of cash on hand at all times. She said it was from these funds that she reimbursed Wade for luxury trips, which is why she had no record of the payments.

Floyd also said he did not meet Wade until 2023 and that he was unaware his daughter had a romantic relationship with Wade until about seven weeks ago, when allegations of Willis’ impropriety were first made in court filings.

During their romantic relationship, which ended last summer, Wade and Willis vacationed in wine country in California, the Caribbean and other destinations.

Michael Roman, a GOP political operative and co-defendant in the Trump case, first alleged that Willis had a conflict of interest in the case because she benefited financially from hiring her lover. Four co-defendants have made similar accusations.

The crux of the defense's case is whether it can prove with a money trail that Willis has a conflict of interest in the case against Trump and should thus be disqualified.

GEORGIA DA FANI WILLIS WILL NOT TESTIFY FOR SECOND DAY ON 'IMPROPER' AFFAIR WITH NATHAN WADE

Willis testified that she reimbursed Wade for her share of vacation expenses in cash, but she and Wade testified there were no receipts for those transactions.

The defense, led by Merchant, is also trying to prove Willis and Wade were romantically involved prior to Wade’s employment in the DA’s office.

Both Willis and Wade insisted that their relationship started in 2022, after Wade was hired. But they contradicted testimony from Robin Yeartie, a former ""good friend"" of Willis and past employee at the DA's office.

Yeartie said she had ""no doubt"" Willis and Wade's relationship started in 2019, after the two met at a conference.

She testified to observing Willis and Wade ""hugging"" and ""kissing"" and showing ""affection"" prior to November 2021 and that she had no doubt that the two were in a ""romantic"" relationship starting in 2019 and lasting until she and Willis last spoke in 2022.

Willis dismissed Yeartie’s testimony and said she no longer considers Yeartie a friend.

The highlight of the two-day proceeding was Willis’ own — and unexpected — testimony, which was described by one expert as ""belligerent.""

CLICK HERE TO GET THE FOX NEWS APP

She verbally sparred with lawyers for hours, at one point prompting the judge to threaten to strike her testimony. She also raised eyebrows by appearing to wear her dress backward. She did not return to the witness stand the following day.

McAfee said at the start of the proceedings this month that it’s ""clear that disqualification can occur if evidence is produced demonstrating an actual conflict or the appearance of one.""

Fox News Digital's Chris Pandolfo contributed to this report.","{'href': 'https://www.foxnews.com', 'title': 'Fox News'}"
65e26ce965be8c6f9d99ed5a,Americans question why Nikki Haley remains in GOP primary: 'She's out of control',https://static.foxnews.com/foxnews.com/content/uploads/2024/02/nikki-thumb-2.png,"['https://a57.foxnews.com/static.foxnews.com/foxnews.com/content/uploads/2024/02/348/196/Laken-Riley-UGA-Student-Death_09.jpg?ve=1&tl=1', 'https://a57.foxnews.com/static.foxnews.com/foxnews.com/content/uploads/2023/06/348/196/Biden-Power-plant.jpg?ve=1&tl=1', 'https://static.foxnews.com/foxnews.com/content/uploads/2024/02/nikki-thumb-2.png', 'https://a57.foxnews.com/static.foxnews.com/foxnews.com/content/uploads/2023/03/348/196/georgia-state-capitol-atlanta.jpg?ve=1&tl=1', 'https://a57.foxnews.com/static.foxnews.com/foxnews.com/content/uploads/2024/02/348/196/AP24060116621195.jpg?ve=1&tl=1', 'https://static.foxnews.com/foxnews.com/content/uploads/2022/11/NEWSLETTER_POLITICS-532x120.png', 'https://a57.foxnews.com/cf-images.us-east-1.prod.boltdns.net/v1/static/694940094001/75ae1c0c-37be-4f75-9e30-fcef83471f9e/b75a2cf8-892f-45d9-8d4f-1dbb1b8c7954/1280x720/match/720/405/image.jpg?ve=1&tl=1', 'https://a57.foxnews.com/static.foxnews.com/foxnews.com/content/uploads/2024/01/1200/675/2024-01-03T005940Z_675026719_RC20A5A8PN1P_RTRMADP_3_USA-ELECTION-HALEY.jpg?ve=1&tl=1', 'https://a57.foxnews.com/static.foxnews.com/foxnews.com/content/uploads/2024/02/1200/675/3c8d5c28-Haley-Trump.jpg?ve=1&tl=1', 'https://a57.foxnews.com/static.foxnews.com/foxnews.com/content/uploads/2022/10/340/340/qRbbnPwC_400x400-1.jpg?ve=1&tl=1', 'https://a57.foxnews.com/cf-images.us-east-1.prod.boltdns.net/v1/static/694940094001/75ae1c0c-37be-4f75-9e30-fcef83471f9e/b75a2cf8-892f-45d9-8d4f-1dbb1b8c7954/1280x720/match/896/500/image.jpg?ve=1&tl=1']",[],https://www.foxnews.com/politics/americans-question-nikki-haley-remains-gop-primary-shes-control,2024-02-28,Americans question why Nikki Haley remains in GOP primary: 'She's out of control'  Fox News,"Join Fox News for access to this content Plus special access to select articles and other premium content with your account - free of charge. Please enter a valid email address.

Americans questioned why Nikki Haley is still in the Republican primary as GOP front-runner former President Trump continues to dominate elections, even in the former South Carolina governor's home state.

""She probably should drop out,"" Pete told Fox News while on Music City's famous Broadway street. ""I understand what she's doing, I understand why she's doing it, but she needs to get out.""

But Jodi said ""she should still stay in the race.""

""She's a better candidate than Trump,"" she added.

WATCH MORE FOX NEWS DIGITAL ORIGINALS HERE

Haley is the only remaining challenger to Trump, who is so far undefeated heading into Super Tuesday on Mar. 5, when voters in 16 states will cast their ballot this primary season. Most recently, Trump earned over 40% more votes than Haley in Michigan on Tuesday and beat her by 20% in her home state on Saturday.

""I think she has absolutely no chance against the man,"" Oscar told Fox News the day before Michigan's primary. ""I voted in the New Hampshire primary … When Trump won, I think that was a defining moment where everybody realized that he's going to be the candidate once again.""

""I really don't know what she's doing,"" he continued. ""She's out of control.""

Similarly, Scott said, ""she needs to get out"" of the race. ""It's just a waste of money for her to stay in,"" he added.

KOCH-BACKED NETWORK DROPS FUNDING FOR NIKKI HALEY CAMPAIGN AFTER SOUTH CAROLINA DEFEAT

Several people said funding from big donors has kept her in the race. Since the start of the primaries, the largest Haley-aligned super PAC has received donations from Wall Street megadonors, big names like billionaire Charles Koch’s political network, Americans for Prosperity Action and even a top Democratic donor, Reid Hoffman.

""She’s getting funded by the other side. That's what they do."" George said. ""If they can't win their side, they will fund somebody else's side just to try to get her in.""

But Dan said he had ""no idea why there would be any money behind her whatsoever.""

""She’s got no path to victory,"" he continued.

Theresa said: ""She's just been encouraged by a lot of the anti-Trump people to stay in. It just hurts the party, I think.""

Some said Haley was only staying in the race to swoop in as the nominee if Trump, for some reason, becomes ineligible amid his ongoing legal battles. Trump is fighting four separate lawsuits and dozens of felony charges while seeking to lock up the Republican presidential nomination.

""I think she's just staying in hopes that something happens with Trump,"" Scott told Fox News. ""Whether it's legal issues or something that's going to knock him out.""

CLICK HERE TO GET THE FOX NEWS APP

Similarly, Pete said the only reason she refuses to drop out is because ""we don't really know what's going to happen with Trump.""

""I like Trump,"" he said. ""Will he be there? I hope he's there in the end, but I can't guarantee he will be.""

But Josh said Haley's effort ""seems pointless.""

""It seems like an inevitable match-up between Trump and Biden again at this point,"" he told Fox News, ""which I don't really think anyone wants. So it’s surprising that that continues to happen.""","{'href': 'https://www.foxnews.com', 'title': 'Fox News'}"
