_id,title,top_image,images,videos,url,date,short_description,text,publisher
65e3be0ca5010e88ee4353a9,McCaul demands UNRWA chief testify before Congress over alleged ties to Hamas,https://static.foxnews.com/foxnews.com/content/uploads/2024/03/Safeimagekit-resized-img-22.jpeg,"['https://static.foxnews.com/foxnews.com/content/uploads/2024/03/Safeimagekit-resized-img-22.jpeg', 'https://a57.foxnews.com/static.foxnews.com/foxnews.com/content/uploads/2024/02/348/196/Kamala-Harris.jpg?ve=1&tl=1', 'https://static.foxnews.com/foxnews.com/content/uploads/2022/11/NEWSLETTER_POLITICS-532x120.png', 'https://a57.foxnews.com/cf-images.us-east-1.prod.boltdns.net/v1/static/694940094001/549fcd06-1411-40ac-9e17-889090c2c378/9a789cb7-774a-4911-be7c-16aae628eec1/1280x720/match/896/500/image.jpg?ve=1&tl=1', 'https://a57.foxnews.com/static.foxnews.com/foxnews.com/content/uploads/2024/03/348/196/biden-oval.jpg?ve=1&tl=1', 'https://a57.foxnews.com/static.foxnews.com/foxnews.com/content/uploads/2024/02/348/196/transgender-prisoners.jpg?ve=1&tl=1', 'https://a57.foxnews.com/static.foxnews.com/foxnews.com/content/uploads/2024/03/1200/675/GettyImages-1999803315.jpg?ve=1&tl=1', 'https://a57.foxnews.com/static.foxnews.com/foxnews.com/content/uploads/2024/02/348/196/3b82f817-Biden.jpg?ve=1&tl=1', 'https://a57.foxnews.com/static.foxnews.com/foxnews.com/content/uploads/2024/03/1200/675/Safeimagekit-resized-img-22.jpeg?ve=1&tl=1']",[],https://www.foxnews.com/politics/mccaul-demands-unrwa-chief-testify-before-congress-over-alleged-ties-to-hamas,2024-03-01,McCaul demands UNRWA chief testify before Congress over alleged ties to Hamas  Fox News,"Join Fox News for access to this content Plus special access to select articles and other premium content with your account - free of charge. Please enter a valid email address.

The House Foreign Affairs Committee is demanding that the head of a global Palestinian refugee agency testify before Congress over the ""many troubling allegations"" leveled against it amid Israel's war on Hamas in Gaza.

Chairman Michael McCaul, R-Texas, sent a letter to United Nations Relief and Works Agency for Palestine Refugees in the Near East (UNRWA) Commissioner-General Philippe Lazzarini insisting that he sit for a public hearing.

""I remain extremely concerned over UNRWA’s widespread allegations of corruption and the millions of taxpayer dollars already sent to UNRWA this fiscal year. A full accounting of UNRWA’s complicity in the October 7th attack – as with all instances of terrorism – is urgently needed,"" McCaul told Fox News Digital.

He said his committee has already heard testimony ""that directly contradicts UNRWA’s claims"" and ""it is now more important than ever that the American people hear directly from Mr. Lazzarini in a public setting.""

TEXAS DEM RUNNING TO UNSEAT TED CRUZ HAS RECEIVED THOUSANDS IN DONATIONS FROM ANTI-ISRAEL ACTIVISTS

Lazzarini had agreed to come before the committee in late January in a ""closed, members-only setting,"" according to the letter, citing ""UN privileges and immunities"" that prevented him from appearing in the open.

""With regard to your letter, we must first point out that UN privileges and immunities do not forbear voluntary testimony,"" the lawmakers responded. ""Second, many members of this Committee are gravely concerned, but sadly, unsurprised by allegations that employees of UNRWA participated in the horrendous October 7th attack and that thousands of employees have familial or direct ties to Hamas and other terrorist organizations.""

""Furthermore, we are outraged by recent reporting that a Hamas military installation and server room is located directly beneath UNRWA’s Gaza headquarters. To make matters worse, Hamas operated this installation by siphoning electricity from UNRWA.""

McCaul pointed out that Lazzarini had appeared before European lawmakers in 2021 and 2022 for ""an Exchange of Views in the European Parliament’s Committee on Foreign Affairs (AFET).""

‘SQUAD’ MEMBER RASHIDA TLAIB REFUSES TO SAY WHETHER SHE'LL VOTE FOR BIDEN DURING CEASE-FIRE PRESSER

""If you are willing to appear before the AFET, you surely can and would be willing to appear before the House Foreign Affairs Committee especially given the United States’ long term and considerable financial support to UNRWA,"" he said.

The letter is co-led by Reps. Brian Mast, R-Fla., Darrell Issa, R-Calif., and Chris Smith, R-N.J., subcommittee chairs on Foreign Affairs.

The U.N. is conducting an internal, but independent investigation after Israel accused 12 UNRWA staffers of taking part in Hamas’ Oct. 7 attack last year that killed more than 1,200 people – mostly civilians.

The Biden administration has paused funding for the agency, which provides aid to Palestinian refugees, after the allegations were leveled. The U.S. had designated $51 million toward UNRWA for fiscal year 2024.

BIDEN ADMIN CUTS FUNDING TO CONTROVERSIAL UN AGENCY AMID ALLEGATIONS MEMBERS ASSISTED IN HAMAS MASSACRE

Last month, Lazzarini condemned Israel for allegedly striking an UNRWA facility in Gaza and killing nine people. Israel has denied responsibility for the attack.

CLICK HERE TO GET THE FOX NEWS APP

""The compound is a clearly marked UN facility & its coordinates were shared with Israeli Authorities as we do for all our facilities. Once again a blatant disregard of basic rules of war,"" Lazzarini wrote on X.

Fox News Digital reached out to UNRWA for comment on the letter but did not immediately hear back.","{'href': 'https://www.foxnews.com', 'title': 'Fox News'}"
65e3be0ca5010e88ee4353aa,House GOP lawmakers from Georgia blame Biden's 'disastrous' border policies for murder of Laken Riley,https://static.foxnews.com/foxnews.com/content/uploads/2024/02/Laken-Riley-CBP-funding-Jose-Ibarra-mugshot.jpg,"['https://a57.foxnews.com/static.foxnews.com/foxnews.com/content/uploads/2024/02/348/196/mary_ellen_withrow.jpg?ve=1&tl=1', 'https://a57.foxnews.com/static.foxnews.com/foxnews.com/content/uploads/2024/02/348/196/Haley-Trump.jpg?ve=1&tl=1', 'https://a57.foxnews.com/static.foxnews.com/foxnews.com/content/uploads/2023/03/340/340/Brooke-Singman.png?ve=1&tl=1', 'https://a57.foxnews.com/static.foxnews.com/foxnews.com/content/uploads/2024/02/1200/675/USATSI_22626057-1.jpg?ve=1&tl=1', 'https://static.foxnews.com/foxnews.com/content/uploads/2022/11/NEWSLETTER_POLITICS-532x120.png', 'https://a57.foxnews.com/cf-images.us-east-1.prod.boltdns.net/v1/static/694940094001/bc459413-4fae-4238-8232-faea8152d677/b7114e17-c629-4616-8b48-4377fae5d1c4/1280x720/match/896/500/image.jpg?ve=1&tl=1', 'https://a57.foxnews.com/static.foxnews.com/foxnews.com/content/uploads/2024/01/348/196/GettyImages-1938768468-1.jpg?ve=1&tl=1', 'https://static.foxnews.com/foxnews.com/content/uploads/2024/02/Laken-Riley-CBP-funding-Jose-Ibarra-mugshot.jpg', 'https://a57.foxnews.com/static.foxnews.com/foxnews.com/content/uploads/2024/02/1200/675/USATSI_15326287-2.jpg?ve=1&tl=1', 'https://a57.foxnews.com/static.foxnews.com/foxnews.com/content/uploads/2024/02/1200/675/3d751c44-UGA-Laken-Riley-Jose-Antonio-Ibarra-Murder_01.jpg?ve=1&tl=1', 'https://a57.foxnews.com/static.foxnews.com/foxnews.com/content/uploads/2022/07/348/196/Supreme-Court.jpg?ve=1&tl=1']",[],https://www.foxnews.com/politics/house-gop-lawmakers-georgia-blame-bidens-disastrous-border-policies-murder-laken-riley,2024-02-28,House GOP lawmakers from Georgia blame Biden's 'disastrous' border policies for murder of Laken Riley  Fox News,"FIRST ON FOX: Republican lawmakers from Georgia are blaming President Biden’s ""disastrous"" border and immigration policies for the murder of 22-year-old Laken Riley at the hands of an illegal migrant.

Riley, a 22-year-old nursing student at Augusta University, was found dead on the University of Georgia campus Thursday after her roommate reported to authorities that she had not returned home from her morning run.

Rep. Barry Loudermilk, R-Ga., led the Georgia Republican Congressional delegation in writing a letter to President Biden on Wednesday. Fox News Digital first obtained the letter, which blasts the president for his border policies, and his reversal of those from the Trump administration, saying his actions have had ""devastating consequences,"" and demands immediate action.

BIDEN WHITE HOUSE RESPONDS TO LAKEN RILEY MURDER ON UGA CAMPUS: 'PEOPLE SHOULD BE HELD ACCOUNTABLE'

The University of Georgia Police Department arrested Jose Antonio Ibarra and charged him with malice murder, felony murder, aggravated battery, aggravated assault, false imprisonment, kidnapping, hindering a 911 call and concealing the death of another, UGA Police Chief Jeffrey L. Clark said during a news briefing Friday evening.

The suspect is not a U.S. citizen. Immigration and Customs Enforcement (ICE) on Sunday confirmed that the Venezuelan national entered the U.S. illegally in 2022 and had previously been arrested in New York City.

""Every parent, and every American is extremely shocked and heartbroken to learn of the murder of Laken Hope Riley, a 22-year-old nursing student from Woodstock, brutally murdered by illegal immigrant and Venezuelan national Jose Antonio Ibarra while jogging on the University of Georgia campus on February 22, 2024,"" Loudermilk and his colleagues wrote. ""Our prayers are with Laken’s family and friends as they begin to navigate this tremendously difficult time.""

TRUMP BLAMES 'BIDEN'S BORDER INVASION' FOR LAKEN RILEY MURDER, VOWS 'LARGEST DEPORTATION OPERATION' IF ELECTED

They added, ""Your inaction to resolve the unprecedented humanitarian and national security crises at the U.S. Southern border has directly led to her tragic death.""

""Your disastrous border policies have turned every community into a border community and destroyed countless American families like Laken’s,"" they wrote.

The GOP lawmakers challenged Biden, saying he ""should not wait until your State of the Union address on March 7, 2024, to announce changes to immigration policy.""

""The proliferation of deadly fentanyl, the increased threat of human trafficking by drug cartels, and the impacts illegal immigration has had on our nation’s cities – all must be immediately addressed,"" they wrote, adding that Biden should ""immediately revoke your harmful executive orders"" and ""issue new executive orders that regain full operational control of the U.S. southern border.""

Biden ""should empower ICE to remove the aliens who have criminal convictions or pending criminal charges, including those who fail to appear for their court date. You should issue a Statement of Administration Policy in support of H.R. 2, urge the Senate take up its consideration, and quickly sign and enact it,"" the lawmakers wrote.

""When you fail to secure operational control of our nation’s border, you should be fully transparent and accountable with both our nation’s governors and the American people,"" they wrote, urging Biden to reply to Georgia Gov. Brian Kemp’s letter from this week demanding information on Ibarra.

BIDEN, TRUMP TO MAKE US-MEXICO BORDER STOPS THURSDAY AS MIGRANT CRISIS ROILS ELECTION

""Mr. President, we must ensure justice for Laken, and that starts by securing the border,"" they continued. ""We will not waver in our effort to resist your administration’s failing policies that weaken our nation’s immigration law and national security.""

The letter was signed by Loudermilk, along with Reps. A. Drew Ferguson IV, Buddy Carter, Rich McCormick, Austin Scott, Andrew Clyde, Mike Collins, Rick Allen and Marjorie Taylor Greene.

Loudermilk told Fox News Digital that Riley’s murder ""has devastated our community, sending shockwaves across the state and the nation.""

""President Biden’s refusal to enforce our immigration laws has resulted in unprecedented humanitarian and national security crises at our southern border,"" Loudermilk told Fox News Digital. ""His unwillingness to act directly led to Laken’s tragic death.""

""Laken Riley’s murder could have been prevented if our border was secure and illegal aliens weren’t flooding into our country,"" Greene said in a statement to Fox News Digital. ""Joe Biden, Homeland Security Secretary Alejandro Mayorkas, and the rest of the Biden adminisitration have blood on their hands.""

She added, ""It’s past time to act.""

The letter comes after the White House weighed in on the tragedy days after it transpired.

""We would like to extend our deepest condolences to the family and loved ones of Laken Hope Riley,"" a White House spokesperson told Fox News Digital. ""People should be held accountable to the fullest extent of the law if they are found to be guilty. Given this is an active case, we would have to refer you to state law enforcement and ICE.""

CLICK HERE TO GET THE FOX NEWS APP

The demands also come just a day before President Biden is set to make a trip to the U.S. southern border. He is expected to travel to Brownsville, Texas, and is set to meet with U.S. Border Patrol agents and law enforcement.

Meanwhile, Biden’s trip comes the same day as former President Trump’s. The 2024 GOP frontrunner is set to deliver a speech in Eagle Pass, Texas.

Trump also has blamed Biden’s border policies for the ""invasion"" that led to Riley’s death.

Fox News' Adam Shaw contributed to this report.","{'href': 'https://www.foxnews.com', 'title': 'Fox News'}"
65e3be0ca5010e88ee4353ab,"Illinois judge removes Trump from state ballot, citing 'insurrectionist ban'",https://static.foxnews.com/foxnews.com/content/uploads/2024/01/GettyImages-1938768468-1.jpg,"['https://a57.foxnews.com/static.foxnews.com/foxnews.com/content/uploads/2024/02/1200/675/GettyImages-2036614182.jpg?ve=1&tl=1', 'https://a57.foxnews.com/cf-images.us-east-1.prod.boltdns.net/v1/static/694940094001/c8285a87-d920-46e7-8d5d-53f892b27b6a/5b042025-5cc1-496e-8fef-d61655585bc3/1280x720/match/896/500/image.jpg?ve=1&tl=1', 'https://a57.foxnews.com/static.foxnews.com/foxnews.com/content/uploads/2023/10/340/340/IMG_6323.jpg?ve=1&tl=1', 'https://a57.foxnews.com/static.foxnews.com/foxnews.com/content/uploads/2024/01/1200/675/GettyImages-1938768468-1.jpg?ve=1&tl=1', 'https://a57.foxnews.com/static.foxnews.com/foxnews.com/content/uploads/2024/02/348/196/Kamala-Harris-Orangeburg-S.C.-Feb.-2-2024.jpg?ve=1&tl=1', 'https://a57.foxnews.com/static.foxnews.com/foxnews.com/content/uploads/2022/06/348/196/AP22155840298932.jpg?ve=1&tl=1', 'https://static.foxnews.com/foxnews.com/content/uploads/2024/01/GettyImages-1938768468-1.jpg', 'https://a57.foxnews.com/static.foxnews.com/foxnews.com/content/uploads/2024/02/348/196/james-biden-dc.jpg?ve=1&tl=1', 'https://a57.foxnews.com/static.foxnews.com/foxnews.com/content/uploads/2023/07/1200/675/GettyImages-1395977284.jpg?ve=1&tl=1', 'https://static.foxnews.com/foxnews.com/content/uploads/2022/11/NEWSLETTER_POLITICS-532x120.png', 'https://a57.foxnews.com/static.foxnews.com/foxnews.com/content/uploads/2024/02/348/196/Protest-2024-02-16-135719.png?ve=1&tl=1']",[],https://www.foxnews.com/politics/illinois-judge-removes-former-president-donald-trump-from-state-ballot-because-of-insurrectionist-ban,2024-02-29,"Illinois judge removes Trump from state ballot, citing 'insurrectionist ban'  Fox News","Join Fox News for access to this content Plus special access to select articles and other premium content with your account - free of charge. Please enter a valid email address.

An Illinois judge announced late Wednesday that former President Donald Trump has been removed from the state’s 2024 Republican presidential primary ballot over his alleged role in the Jan. 6, 2021, Capitol riot.

Cook County Circuit Judge Tracie Porter barred Trump from the Illinois ballot one month after the anti-Trump challenge was dismissed by the Illinois State Board of Elections.

According to court documents obtained by Fox News, Porter gave the order on Wednesday, urging the board to remove Trump or ""cause any votes cast for him to be suppressed,"" for violating section three of the 14th Amendment, or the ""disqualification clause,"" for engaging in insurrection.

Porter's ruling reverses last month's decision by the Illinois Board of Elections to keep Trump's name on the primary ballot after a group of Illinois voters accused the former president of engaging in insurrection.

REPUBLICAN EX-JUDGE ARGUED TRUMP ENGAGED IN INSURRECTION, SHOULD BE REMOVED FROM ILLINOIS PRIMARY BALLOT

However, the order is put on hold until Friday, in case of an appeal from Trump's attorneys to the Illinois Appellate Court, First District or the Illinois Supreme Court.

A campaign spokesperson for Trump issued a statement to Reuters saying it ""is an unconstitutional ruling that we will quickly appeal.""

The U.S. Supreme Court is considering for the first time the meaning and reach of Section 3 of the Constitution’s 14th Amendment, which bars former officeholders who ""engaged in insurrection"" from holding public office again.

The 14th Amendment, Section 3 of the Constitution states, ""No person shall… hold any office… under the United States… who, having previously taken an oath, as a member of Congress, or as an officer of the United States… to support the Constitution of the United States, shall have engaged in insurrection or rebellion against the same, or given aid or comfort to the enemies thereof.""

TRUMP SAYS HE'S A 'BELIEVER' IN THE SUPREME COURT AFTER ORAL ARGUMENTS IN COLORADO BALLOT CASE

Trump has never been charged with inciting an insurrection.

Nancy Pelosi took to X, formerly Twitter, to share her thoughts on the ruling.

""The Supreme Court is placing itself on trial with its decision to hear the former president’s total immunity claim. It remains to be seen whether the justices will uphold the fundamental American value that no one is above the law – not even a former president,"" Pelosi wrote.

HOUSE DEMOCRAT FROM MAINE RIPS STATE'S DECISION TO TAKE TRUMP OFF BALLOT

The court will make a decision no later than the end of June on whether Trump can be prosecuted for election interference, The Associated Press reports.

Illinois is now the third state where Trump was booted from the ballot, after Colorado and Maine.

CLICK HERE TO GET THE FOX NEWS APP

But those decisions were paused pending the appeal of the Colorado case to the U.S. Supreme Court.

The primary election is set for March 19.

Fox News' Garrett Tenney and Brooke Singman contributed to this report.","{'href': 'https://www.foxnews.com', 'title': 'Fox News'}"
