_id,title,top_image,images,videos,url,date,short_description,text,publisher
65e2688211fa4540a0a38b3b,"7.2M illegals entered the US under Biden admin, an amount greater than population of 36 states",https://static.foxnews.com/foxnews.com/content/uploads/2024/02/biden-migrant-crisis-quarters.jpg,"['https://a57.foxnews.com/static.foxnews.com/foxnews.com/content/uploads/2022/06/348/196/AP22155840298932.jpg?ve=1&tl=1', 'https://a57.foxnews.com/static.foxnews.com/foxnews.com/content/uploads/2024/02/1200/675/GettyImages-1988734939.jpg?ve=1&tl=1', 'https://a57.foxnews.com/static.foxnews.com/foxnews.com/content/uploads/2024/02/348/196/james-biden-dc.jpg?ve=1&tl=1', 'https://a57.foxnews.com/static.foxnews.com/foxnews.com/content/uploads/2023/01/340/340/Chris-Pandolfo-Headshot.jpg?ve=1&tl=1', 'https://a57.foxnews.com/static.foxnews.com/foxnews.com/content/uploads/2024/02/348/196/Protest-2024-02-16-135719.png?ve=1&tl=1', 'https://a57.foxnews.com/static.foxnews.com/foxnews.com/content/uploads/2024/02/1200/675/migrants-cross-into-us.jpg?ve=1&tl=1', 'https://a57.foxnews.com/cf-images.us-east-1.prod.boltdns.net/v1/static/694940094001/16759a56-49c8-47ac-adef-821c5ddad367/1ef874ff-8fe4-4fe7-a452-917b90705e33/1280x720/match/896/500/image.jpg?ve=1&tl=1', 'https://static.foxnews.com/foxnews.com/content/uploads/2022/11/NEWSLETTER_POLITICS-532x120.png', 'https://a57.foxnews.com/static.foxnews.com/foxnews.com/content/uploads/2024/02/1200/675/illegal-immigration-texas.jpg?ve=1&tl=1', 'https://a57.foxnews.com/static.foxnews.com/foxnews.com/content/uploads/2024/02/1200/675/migrants-texas-razor-wire.jpg?ve=1&tl=1', 'https://a57.foxnews.com/static.foxnews.com/foxnews.com/content/uploads/2024/02/348/196/Kamala-Harris-Orangeburg-S.C.-Feb.-2-2024.jpg?ve=1&tl=1', 'https://static.foxnews.com/foxnews.com/content/uploads/2024/02/biden-migrant-crisis-quarters.jpg']",[],https://www.foxnews.com/politics/illegal-immigrants-biden-admin-amount-greater-population-36-states,2024-02-20,"7.2M illegals entered the US under Biden admin, an amount greater than population of 36 states  Fox News","Join Fox News for access to this content Plus special access to select articles and other premium content with your account - free of charge. Please enter a valid email address.

Nearly 7.3 million migrants have illegally crossed the southwest border under President Biden's watch, a number greater than the population of 36 individual states, a Fox News analysis finds.

That figure comes from U.S. Customs and Border Protection (CBP), which has already reported 961,537 border encounters in the current fiscal year, which runs from October through September. If the current pace of illegal immigration does not slow down, fiscal year 2024 will break last year's record of 2,475,669 southwest border encounters — a number that by itself exceeds the population of New Mexico, a border state.

The total number of southwest land border encounters since Biden assumed office in 2021 is 7,298,486, CBP data shows.

That is larger than the population of 36 U.S. states, including Alabama, Alaska, Arkansas, Colorado, Connecticut, Delaware, Hawaii, Idaho, Indiana, Iowa, Kansas, Kentucky, Louisiana, Maine, Maryland, Massachusetts, Minnesota, Mississippi, Missouri, Montana, Nebraska, Nevada, New Hampshire, New Mexico, North Dakota, Oklahoma, Oregon, Rhode Island, South Carolina, South Dakota, Tennessee, Utah, Vermont, West Virginia, Wisconsin and Wyoming.

MIGRANTS CAUGHT ON NEW VIDEO STREAMING DOWN REMOTE CALIFORNIA MOUNTAINSIDE TO ILLEGALLY CROSS THE BORDER

Compared to the largest U.S. states, the 7.3 million number is about 18.7% of California's population of 39 million; 23.9% of the state of Texas and its 31 million residents; 32.3% of the population of Florida; and 37.3% of New York. It's more than half the size of Pennsylvania, Illinois and Ohio.

Were the number of illegal immigrants who entered the U.S. under President Biden gathered together to found a city, it would be the second-largest city in America after New York. And the total does not include an estimated additional 1.8 million known ""gotaways"" who evaded law enforcement, which would make it bigger than New York.

Taken together, nearly 10 million migrants have crossed into the U.S. illegally during the Biden administration, a record Biden's critics assert could only be achieved by intentionally refusing to enforce the law.

""This unprecedented surge in illegal immigration isn't an accident. It is the result of deliberate policy choices by the Biden administration,"" said Eric Ruark, Director of Research for Numbers USA, a nonprofit that advocates for immigration restrictions.

The Department of Homeland Security did not respond to a request for comment.

MIGRANT CRISIS: NOEM SENDS NATIONAL GUARD TO SOUTHERN BORDER'S ‘WARZONE’

Republicans and anti-illegal immigration activists have for years blamed Biden for allowing the current overwhelming surge of migrants by reversing former President Donald Trump's border policies. The Biden administration has denied responsibility for the crisis and pointed to external ""push"" factors like violence and economic instability in South and Central America as the culprit responsible for vast waves of migration to the U.S.

However, the president's critics say migrants face more of a ""pull"" factor in the form of job opportunities and government benefits because they know they will not face deportation under Biden's lenient policies.

""The administration has refused to enforce existing immigration law and taken every opportunity to aid and abet illegal border crossings — through policies such as catch-and-release, mass parole and offering temporary work permits to tens of thousands of foreigners who make dubious claims for asylum,"" Ruark told Fox News Digital. ""In actual effect, the United States government is completing the human smuggling and trafficking process for the Mexican cartels.""

Ira Mehlman, a spokesman for the Federation for American Immigration Reform (FAIR), said migrants have learned in the last three years that they won't face deportation for entering the country illegally.

""They have sent the signal that if you come to the U.S. illegally, if you abuse the asylum system, you'll be released into the country and allowed to remain here, in most cases given work authorization,"" Mehlman said. ""Even if you neglect to show up for your hearings, the odds of you being removed are negligible. The president claims he doesn't have the authority to enforce our laws. He absolutely does. He is deliberately not enforcing those laws.""

LARGE MAJORITY OF ILLEGAL BORDER CROSSING SHIFT TO ARIZONA AND CALIFORNIA, PIVOTING AWAY FROM TEXAS

Biden has called on Congress to pass new laws he claims would let him solve the border crisis. He endorsed a bipartisan deal in the Senate that included an ""emergency border authority"" to mandate Title 42-style expulsions of migrants when migration levels exceed 5,000 a day over a seven-day rolling average. It would have also limited the window for people to apply for asylum, provided immediate work permits for asylum seekers and funded a massive increase in staffing at the border and more immigration judges.

But conservatives tanked the deal in the Senate after House Republicans declared it a non-starter. They argued the bill would have normalized record-high levels of illegal immigration and said Biden currently has all the authority he needs to reenact Trump's policies and secure the border.

While the debate rages, House Republicans have impeached Homeland Security Secretary Alejandro Mayorkas for allegedly refusing to enforce immigration laws. Two impeachment articles advanced against Mayorkas accused him of having ""refused to comply with Federal immigration laws"" and violating the ""public trust.""

CLICK HERE TO GET THE FOX NEWS APP

DHS has criticized the effort as politically motivated and insisted the Biden administration is enforcing the laws on the books.

Biden said that ""history will not look kindly on House Republicans for their blatant act of unconstitutional partisanship that has targeted an honorable public servant in order to play petty political games.""

Fox News' Bill Melugin, Adam Shaw and Jamie Joseph contributed to this report.","{'href': 'https://www.foxnews.com', 'title': 'Fox News'}"
65e2688211fa4540a0a38b3c,GOP lawmakers slam Biden admin in reaction to college murder suspect’s immigration status: ‘Close the border!’,https://static.foxnews.com/foxnews.com/content/uploads/2024/02/jose-ibarra-mugshot.jpg,"['https://a57.foxnews.com/static.foxnews.com/foxnews.com/content/uploads/2024/02/348/196/hunter_biden_deposition_getty.jpg?ve=1&tl=1', 'https://a57.foxnews.com/static.foxnews.com/foxnews.com/content/uploads/2023/01/340/340/haley-chi-sing.jpg?ve=1&tl=1', 'https://a57.foxnews.com/static.foxnews.com/foxnews.com/content/uploads/2023/11/348/196/Just-Stop-Oil-compilation.jpg?ve=1&tl=1', 'https://a57.foxnews.com/cf-images.us-east-1.prod.boltdns.net/v1/static/694940094001/5abbd647-8936-4de0-b407-c919c95a6529/fb7a481f-a6fe-4789-a02d-fe8fff75d653/1280x720/match/896/500/image.jpg?ve=1&tl=1', 'https://a57.foxnews.com/static.foxnews.com/foxnews.com/content/uploads/2024/01/1200/675/KJP5.jpg?ve=1&tl=1', 'https://a57.foxnews.com/static.foxnews.com/foxnews.com/content/uploads/2024/02/1200/675/Laken-Riley-UGA-Student-Death_09.jpg?ve=1&tl=1', 'https://static.foxnews.com/foxnews.com/content/uploads/2022/11/NEWSLETTER_POLITICS-532x120.png', 'https://static.foxnews.com/foxnews.com/content/uploads/2024/02/jose-ibarra-mugshot.jpg', 'https://a57.foxnews.com/static.foxnews.com/foxnews.com/content/uploads/2024/02/1200/675/jose-ibarra-mugshot.jpg?ve=1&tl=1', 'https://a57.foxnews.com/static.foxnews.com/foxnews.com/content/uploads/2024/02/1200/675/Laken-Riley-UGA-Student-Death_07.jpg?ve=1&tl=1', 'https://a57.foxnews.com/static.foxnews.com/foxnews.com/content/uploads/2023/02/348/196/Biden.jpg?ve=1&tl=1', 'https://a57.foxnews.com/static.foxnews.com/foxnews.com/content/uploads/2024/02/348/196/KJP-1.jpg?ve=1&tl=1']",[],https://www.foxnews.com/politics/gop-lawmakers-slam-biden-admin-reaction-college-murder-suspects-immigration-status-close-border,2024-02-24,GOP lawmakers slam Biden admin in reaction to college murder suspect’s immigration status: ‘Close the border!’  Fox News,"Join Fox News for access to this content Plus special access to select articles and other premium content with your account - free of charge. Please enter a valid email address.

Congressional Republicans are slamming the Biden administration's border policies after a Venezuelan immigrant who crossed the border illegally was charged with the murder of a Georgia nursing student.

Twenty-six-year-old Jose Antonio Ibarra, the suspect charged in the murder of nursing student Laken Riley on the University of Georgia campus, is a Venezuelan national who crossed illegally into El Paso, Texas, in September 2022 and was released into the U.S. via parole, three ICE & DHS sources told Fox News.

House Speaker Mike Johnson, R-La., shared his condolences with Riley's family and friends while also reemphasizing Republicans' efforts to pass border legislation.

GEORGIA STUDENT MURDER SUSPECT CONFIRMED TO BE ILLEGAL IMMIGRANT

""The brutal murderer who took the life of Laken was one of the millions of illegal aliens that the Biden Administration simply released and unleashed upon our country,"" Johnson wrote on X, formerly Twitter.

""For Laken, and the countless many others lost to this border catastrophe, House Republicans will continue to fight tooth and nail for a return to law and order. Mr. President, use your existing statutory authority and CLOSE THE BORDER!,"" he added.

Georgia Gov. Brian Kemp posted a letter sent to President Biden on Saturday, ""demanding information"" on Ibarra's immigration status and calling for a holistic approach to border safety.

""Joe Biden's failed policies have turned every state into a border state, and I'm demanding information from him so we can protect our people when the federal government won’t!"" Kemp wrote in an X post.

In the letter, the Republican governor called Biden's silence on illegal immigration statistics ""outrageous.""

""Frankly, Mr. President, your continued silence in response to these reasonable requests is outrageous,"" Kemp said. ""The American people deserve to know who is illegally entering our country due to your administration's failures, and what risks and challenges every state must now face.""

""These tragedies are not unique to Georgia. While we will continue to support Texas with National Guard resources as we have since 2019, federal action to secure the border is the only way to wholistically [sic] address this ongoing crisis and ensure Laken Riley's horrible fate is not replicated across the country,"" he said.

Georgia Republicans Rep. Marjorie Taylor Greene and Rep. Andrew Clyde called out Biden on X, saying that he has ""blood"" on his hands following Riley's death.

""Laken Riley, 22-year-old UGA nursing student, was murdered by an illegal alien from Venezuela that the Biden admin released in our country,"" Greene wrote. ""Joe Biden, Mayorkas, and the Democrats have blood on their hands. Praying for her family.""

""Laken Riley, the 22-year old nursing student found dead on the UGA campus, was murdered by an illegal alien,"" Clyde posted on X. ""The Venezuelan migrant, Jose Antonio Ibarra, illegally crossed the border and was released on parole in September 2022. Joe Biden has blood on his hands.""

LAKEN RILEY CASE: GEORGIA AUTHORITIES IDENTIFY MURDER SUSPECT IN CUSTODY IN NURSING STUDENT'S SLAYING

Rep. Andy Biggs, R-Ariz., of Arizona echoed Greene and Clyde's sentiments, writing, ""These are the tragic consequences of open border policies. The Biden Administration has blood on its hands.""

Senator J.D. Vance, R-Ohio, called the situation enraging, saying that Ibarra should never have been in the country.

""Enraging. He shouldn’t have been in our country. And now an innocent American is dead,"" Vance wrote.

The White House insisted on Friday that House Republicans stand in the way of a solution to what Biden has called a ""broken"" immigration system.

""For the past several months, we worked with Republican senators and also Democrats in the Senate to try to come up with a fair and tough piece of legislation that would deal with border security,"" Press Secretary Karine Jean-Pierre told reporters at the daily White House press briefing.

UNIVERSITY OF GEORGIA POLICE QUESTIONING ‘PERSON OF INTEREST’ IN LAKEN RILEY HOMICIDE

She noted that a bipartisan deal reached last month had been endorsed by the Border Patrol union before Johnson declared it ""dead on arrival.""

""Speaker Johnson has gotten in the way of this,"" Jean-Pierre added. ""We did our job. The Senate did their job in a bipartisan way.

BROTHER OF UGA MURDER SUSPECT CHARGED WITH GREEN CARD FRAUD

Ibarra was taken into custody by UGA police Friday and has been charged with malice murder, felony murder, aggravated battery, aggravated assault, false imprisonment, kidnapping, hindering a 911 call and concealing the death of another, UGA Police Chief Jeffrey L. Clark said during a news briefing Friday evening.

Riley, an Augusta University nursing student, was found dead Thursday after previously attending UGA before entering a nursing program at the University of Augusta's Athens campus.

According to an incident report obtained by Fox News Digital, multiple officers began searching for Riley near the Intramural Fields around 12:07 p.m. At 12:38, a UGA police officer spotted her on the ground.

""I called out to Riley, and I did not get a response,"" the officer wrote.

She had visible injuries, and police could not locate a pulse. They began CPR anyway. A sergeant arrived with a defibrillator minutes later and unsuccessfully attempted to revive the victim.

CLICK HERE TO GET THE FOX NEWS APP

Autopsy results remained pending Friday, but authorities said they were investigating her death as a homicide. Clark said it appeared as though she had been killed by blunt-force trauma.

Kemp's office did not immediately respond to Fox News Digital's request for comment.

Fox News' Michael Ruiz, Chris Pandolfo and Bill Melugin contributed to this report.","{'href': 'https://www.foxnews.com', 'title': 'Fox News'}"
65e2688211fa4540a0a38b3d,"Text messages show timeline of events to disqualify Fani Willis, Trump camp asserts",https://static.foxnews.com/foxnews.com/content/uploads/2024/02/GettyImages-2036328740.jpg,"['https://a57.foxnews.com/static.foxnews.com/foxnews.com/content/uploads/2024/02/348/196/missouri_legislature.jpg?ve=1&tl=1', 'https://static.foxnews.com/foxnews.com/content/uploads/2024/02/GettyImages-2036328740.jpg', 'https://a57.foxnews.com/cf-images.us-east-1.prod.boltdns.net/v1/static/694940094001/cffb722a-0b42-410c-be68-7fd5a03e3811/9d7d2279-03e3-48de-9973-25478a08c762/1280x720/match/896/500/image.jpg?ve=1&tl=1', 'https://a57.foxnews.com/static.foxnews.com/foxnews.com/content/uploads/2024/02/1200/675/Ashleigh-Merchant.jpg?ve=1&tl=1', 'https://a57.foxnews.com/static.foxnews.com/foxnews.com/content/uploads/2024/02/348/196/bidenborder.jpg?ve=1&tl=1', 'https://a57.foxnews.com/static.foxnews.com/foxnews.com/content/uploads/2024/02/1200/675/Fani-Willis-Nathan-Wade.jpg?ve=1&tl=1', 'https://a57.foxnews.com/static.foxnews.com/foxnews.com/content/uploads/2023/12/348/196/GettyImages-1845420889.jpg?ve=1&tl=1', 'https://a57.foxnews.com/static.foxnews.com/foxnews.com/content/uploads/2024/02/348/196/iamanallypg23.jpg?ve=1&tl=1', 'https://static.foxnews.com/foxnews.com/content/uploads/2022/11/NEWSLETTER_POLITICS-532x120.png', 'https://a57.foxnews.com/static.foxnews.com/foxnews.com/content/uploads/2024/02/1200/675/GettyImages-2036328740-e1709226550666.jpg?ve=1&tl=1']",[],https://www.foxnews.com/politics/text-messages-show-timeline-events-disqualify-fani-willis-trump-camp-asserts,2024-02-29,"Text messages show timeline of events to disqualify Fani Willis, Trump camp asserts  Fox News","Join Fox News for access to this content Plus special access to select articles and other premium content with your account - free of charge. Please enter a valid email address.

A crucial witness in the motion to disqualify Fulton County District Attorney Fani Willis from the Georgia election interference case was far more involved in the effort than previously known.

Terrence Bradley — former law partner and divorce attorney of prosecutor Nathan Wade — testified under oath Tuesday regarding what he knew about Georgia prosecutor Fani Willis and special prosector Nathan Wade's personal relationship. Bradley took the stand after Judge Scott McAfee determined Bradley that couldn't claim attorney-client privilege.

Text messages have now emerged that show Bradley cooperated extensively with Ashleigh Merchant, attorney for former President Donald Trump's co-defendant Michael Roman in the Georgia case, in the effort to disqualify Willis.

KEY WITNESS IN FANI WILLIS CASE TESTIFIES HE MAY HAVE LIED IN TEXTS ABOUT FRIENDS' AFFAIR

A cache of over 400 text messages between Bradley and Merchant obtained by the Atlanta Journal-Constitution shows continuous back-and-forth exchanges about Willis's relationship with Wade.

Bradley offered input on individuals to subpoena for testimony on Willis and Wade's relationship. He also derided Willis as ""arrogant,"" encouraging Merchant in her motion to disqualify the district attorney from the Trump case.

""I am nervous,"" Merchant wrote in a text message on Jan. 8 — just a day after filling the motion. ""This is huge.""

Bradley responded, ""You are huge. You will be fine. You are one of the best lawyers I know. Go be great.""

JUDGE SAYS NATHAN WADE'S DIVORCE LAWYER MUST TESTIFY ON RELATIONSHIP WITH FULTON CO. DA FANI WILLIS

Merchant gave Bradley a copy of her motion before filing, asking for guidance to make sure everything was accurate.

""Anything else? Anything that isn’t accurate?"" Merchant texted Bradley.

""Looks good,"" Bradley replied.

One piece of information put forth in the text messages ended up falling apart this week when Bradley testified under oath.

""Do you think it started before she hired him?"" Merchant asked via text on Jan. 5, three days prior to filing the motion.

""Absolutely,"" Bradley replied.

But in court Tuesday, Bradley claimed he was ""speculating"" in those text message exchanges.

FANI WILLIS, NATHAN WADE REFERRED TO GEORGIA STATE BAR FOR MISCONDUCT BY WATCHDOG GROUP

Bradely said he couldn't recall key details or specific information over two dozen times in the roughly two-hour testimony in Fulton County Superior Court on Tuesday. He also claimed he had only ever discussed Wade's relationship with Willis once with Wade.

Lawyers for Trump and his co-defendants who are accusing Willis of having had an ""improper"" affair with Wade will try to connect evidence that Willis and Wade lied about when their relationship began and should therefore be disqualified from the case.

During their romantic relationship, which ended last summer, Wade and Willis vacationed in wine country in California, the Caribbean and other destinations.

CLICK HERE TO GET THE FOX NEWS APP

Roman, a GOP political operative and co-defendant in the Trump case, first alleged that Willis had a conflict of interest in the case because she benefited financially from hiring her lover. Four co-defendants have made similar accusations.

The crux of the defense's case is whether it can prove with a money trail that Willis has a conflict of interest in the case against Trump and should be disqualified.

Fox News Digital's Brianna Herlihy contributed to this report.","{'href': 'https://www.foxnews.com', 'title': 'Fox News'}"
