_id,title,top_image,images,videos,url,date,short_description,text,publisher
65e4453eb6e58c7773b6f24a,"Senate Republicans will face leadership struggle between Trump, McConnell views",https://www.washingtonpost.com/wp-apps/imrs.php?src=https://arc-anglerfish-washpost-prod-washpost.s3.amazonaws.com/public/S7BUWBSETBHEQQCAUESFA7POKE.JPG&w=1440,"['https://news.google.com/dr/resources/images/generic-newsletter-signup.png', 'https://www.washingtonpost.com/wp-apps/imrs.php?src=https://arc-anglerfish-washpost-prod-washpost.s3.amazonaws.com/public/S7BUWBSETBHEQQCAUESFA7POKE.JPG&w=1440', 'https://www.washingtonpost.com/wp-apps/imrs.php?src=https://s3.amazonaws.com/arc-authors/washpost/3b8240aa-04f1-4aa3-9767-aaa4237653fb.png&w=196&h=196']",[],https://news.google.com/rss/articles/CBMiYWh0dHBzOi8vd3d3Lndhc2hpbmd0b25wb3N0LmNvbS9wb2xpdGljcy8yMDI0LzAyLzI4L21pdGNoLW1jY29ubmVsbC1yZXBsYWNlbWVudC1yZXB1YmxpY2FuLXNlbmF0ZS_SAQA?oc=5&hl=en-US&gl=US&ceid=US:en,2024-02-29,"Analysis | Senate Republicans will face leadership struggle between Trump, McConnell views  The Washington Post","The race to succeed Senate Minority Leader Mitch McConnell (R-Ky.) will serve as a microcosm of the same challenges that have confronted the broader Republican Party over the last eight years. The front-runners for the post, Sens. John Thune (R-S.D.) and John Cornyn (R-Tex.), have more than 20 years each in congressional tenure, hailing from the traditional Reagan-Bush orthodoxy that most Republican senators still find comfortable. A third aspirant, Sen. John Barrasso (R-Wyo.), has lurched rightward in recent years as Donald Trump’s nativist populism took root.

And as the surprise McConnell news broke open, with his stepping out of leadership at year’s end, the more junior Republicans began floating other contenders who are more reflexively accommodating to Trump’s wishes.

“There’s no doubt it’s time to turn the page. I mean, we’ve got to turn the page here as a party. We’ve got to get back to supporting working people over corporate interests. We’ve got to get rid of the corporate money that has gushed into our politics,” Sen. Josh Hawley (R-Mo.), a frequent McConnell critic, told reporters.

Advertisement

In many ways, the Senate Republican Conference has served as the last bulwark of traditional conservatism as it’s been represented by McConnell, who won his first Senate race on the coattails of Ronald Reagan’s 1984 landslide reelection.

Even in recent years, a clear majority of Senate Republicans preferred lower taxes for the wealthy and far less government regulations, combined with a strong national defense that would reassure allies and intimidate our rivals.

But that orthodoxy has received its stiffest challenge over the last year, as Hawley and about a dozen other Republicans have vocally opposed McConnell and tried to exert pressure on his potential successors.

In a quick aside during his bombshell speech Wednesday, McConnell noted the GOP’s dramatic shift on global security after his bruising battle with his Trumpian wing to pass legislation that would provide more than $60 billion to Ukraine’s defenses.

Advertisement

“Believe me, I know the politics within my party at this particular moment in time. I have many faults — misunderstanding politics is not one of them,” he said.

Having turned 82 last week, McConnell has seen the entire party shift over the last 17 years, the longest service for any Republican or Democratic leader.

His allies were quick to defend McConnell as not getting pushed out by Trump, with whom he has had a political cold war since late 2020, or his enemies within the GOP conference. “No, I do not think he was forced out in any way. This was his decision,” Sen. Susan Collins (R-Maine) said.

Since McConnell took a nasty fall last March that kept him out of the Senate for six weeks, many Republicans had been wondering how long he would stay on the job. Allies to potential successors engaged in whisper campaigns to try to explain who should get the job.

Advertisement

Now that campaign can be held out in the open, even as the aspirants paused on Wednesday. “Just hold that thought,” Thune said after reporters asked his intentions.

“That election is nine months away, and there’s a much more important election between now and then,” Barrasso said, suggesting the November general election should preoccupy senators’ minds.

Only Cornyn gave a slight admission of his plans. “I think today is about Mitch McConnell, but I’ve made no secret of my intention,” he said.

Some suggested that, behind the scenes, the potential successors have fully launched their bids. “I’ve had a lot of calls today,” Sen. Susan Collins (R-Maine) told reporters late Wednesday.

Every Senate leadership election is the most personal of transactions — sometimes a vote comes down to some political act done a decade or two ago, sometimes it comes from a key legislative favor offered years ago — but this race is shaping up to test those traditions more than ever.

Advertisement

And the decisive cluster of Republican votes is likely to come from those loudest anti-McConnell voices.

Thune starts out with a slight edge over Cornyn, in part because Thune’s current role as No. 2 in leadership, the whip, makes him a natural successor, according to multiple senior GOP aides.

A third of today’s 49 Senate Republicans took office after Cornyn, who served six years as whip and four years as head of Senate Republicans’ campaign arm, left the ranks of elected leadership at the end of 2018.

But most Republicans believe Thune is short of a clear majority of the 49 currently serving in the GOP, with Cornyn maybe up to a handful or so votes behind.

That would leave about a dozen to 15 Republicans up in the air, almost all of whom come from the wing that voted against extending McConnell’s leadership run after the 2022 elections. If this group worked together, they could back Barrasso on a first ballot and possibly leave both Thune and Cornyn short of the majority, while trying to extract concessions from either of the top two to tip the balance on a second ballot.

Advertisement

“There are lots of conversations that are ongoing between all sorts of different collections of senators,” Sen. Ted Cruz (R-Tex.) told reporters.

For Democrats, McConnell’s departure marks a strange twist. Sen. Chris Coons (D-Del.), who won election in 2010, spent his first couple years marveling at how strong McConnell’s leadership team remained despite renegades such as Cruz and Sen. Rand Paul (R-Ky.) in his ranks.

Paul had defeated a top McConnell acolyte in 2010, and Cruz knocked off a close Cornyn ally when he chaired the National Republican Senatorial Committee.

“He managed to hold his caucus together. He managed to deliver on some of their core goals, in particular, capturing the Supreme Court and moving it far to the right,” Coons said, noting three conservative justices appointed under McConnell’s watch.

Advertisement

But Coons noted how much the GOP changed with each election, pointing to Tennessee’s swaps of two establishment Republicans, who were very close to McConnell, for two firebrands.

“There’s been a steady movement toward younger members of the Republican caucus who do not value and support compromise and bipartisanship and respect for leadership,” he said.

Rather than the bitter enemy they spoke of with anger and fury last decade, Democrats have recently appreciated McConnell’s help averting calamities such as government funding shutdowns or defaults on the national debt.

Just Tuesday, after a White House meeting with President Biden and congressional leaders, Senate Majority Leader Charles E. Schumer (D-N.Y.) repeatedly praised McConnell for his strong words in support of Ukraine.

It’s the sort of thing that far-right Republicans despise. One antagonist, Sen. Mike Lee (R-Utah), used his increasingly conspiratorial-driven social media accounts to talk about “The Firm” when criticizing McConnell and Schumer.

The ultimate wild card would be if Trump wins the presidency and wants to try to force GOP senators to elect someone he is most comfortable with.

That would benefit Barrasso, or some other wild-card contender, because Trump used to frequently criticize Thune for his lack of forceful support. Cornyn’s political sins, to the most conservative senators, came by working with Democrats on modest gun-violence legislation in 2022 and a bill to expand U.S. manufacturing of electronic chips.

Advertisement

While senators have traditionally guarded these leadership posts against such outside interference, one notable exception came after the 2002 midterm elections. George W. Bush’s presidential advisers helped push Trent Lott (R-Miss.) out of his expected ascension to majority leader after he made comments in support of Sen. Strom Thurmond (R-S.C.), an avowed segregationist, at his 100th birthday party.

Instead, Republicans elected Bill Frist (R-Tenn.), just eight years as a senator to that point, as majority leader. Frist’s four-year tenure as leader came with lots of discussion about his own ambition to run for president in 2008, a rocky path in which the relative newcomer struggled. He eventually retired from politics altogether.

Veteran Republicans believe those aspirants to McConnell’s job, above all else, need to swear off any ambition beyond the Senate.","{'href': 'https://www.washingtonpost.com', 'title': 'The Washington Post'}"
65e4453eb6e58c7773b6f24b,Here’s who could replace Mitch McConnell as Senate’s top Republican,https://www.washingtonpost.com/wp-apps/imrs.php?src=https://arc-anglerfish-washpost-prod-washpost.s3.amazonaws.com/public/YBGG5YGAKJZZKXGRVRQAAY6Y4M.JPG&w=1440,"['https://news.google.com/dr/resources/images/generic-newsletter-signup.png', 'https://www.washingtonpost.com/wp-apps/imrs.php?src=https://s3.amazonaws.com/arc-authors/washpost/bf898c77-c692-4f06-a062-e42a97c5224d.png&w=196&h=196', 'https://www.washingtonpost.com/wp-apps/imrs.php?src=https://arc-anglerfish-washpost-prod-washpost.s3.amazonaws.com/public/YBGG5YGAKJZZKXGRVRQAAY6Y4M.JPG&w=1440']",[],https://news.google.com/rss/articles/CBMiS2h0dHBzOi8vd3d3Lndhc2hpbmd0b25wb3N0LmNvbS9wb2xpdGljcy8yMDI0LzAyLzI4L3JlcGxhY2UtbWl0Y2gtbWNjb25uZWxsL9IBAA?oc=5&hl=en-US&gl=US&ceid=US:en,2024-02-29,Here's who could replace Mitch McConnell as Senate's top Republican  The Washington Post,"Sen. John Thune (S.D.)

Senate Minority Whip John Thune (S.D.) is the No. 2 Republican in the Senate and one of McConnell’s closest allies. Thune has been in the Senate since 2005, rising through the party’s leadership ranks. Before that, he served in the House for six years. As minority whip, Thune serves as McConnell’s deputy, and it is his job to manage the logistics and math behind the whipping of votes across the conference.

Advertisement

Thune, 63, first joined the Senate GOP leadership in 2006 after then-Senate Republican Whip Trent Lott (Miss.) picked him as chief deputy whip. Thune went on to serve as vice-chair of the Senate Republican Conference before becoming the chairman of the Republican Policy Committee, the No. 4 GOP position in the Senate.

He became the chairman of the Republican Conference in 2012, making him the third-most powerful Republican in the Senate — and the highest-ranking Republican senator in his home state’s history. By 2019, he was the Senate majority whip, a position he held until 2021, when Democrats took the Senate.

Thune also served as chairman of the Senate Commerce Committee for four years until 2019.

After McConnell announced he was stepping away from leadership, reporters flocked to Thune’s office, which sits steps from the Senate floor. There, he said McConnell “leaves really big shoes to fill” but declined to say whether he would run to replace him.

Advertisement

On Thursday, a spokesman for Thune said the senator is “reaching out to each of his colleagues directly to discuss the future of the Senate Republican Conference and what they would like to see in their next leader.”

Share this article Share

“He looks forward to having substantive conversations over the next few days and weeks about the future, but he intends on keeping those conversations private,” the spokesman said.

Thune endorsed former president Donald Trump’s White House bid on Sunday, despite a rift between the two. Trump became highly critical of Thune — and even called for him to be primaried — after Thune and McConnell refused to help Trump overturn the results of the 2020 election.","{'href': 'https://www.washingtonpost.com', 'title': 'The Washington Post'}"
65e4453eb6e58c7773b6f24c,What the Michigan primary tells us about about November,https://www.washingtonpost.com/wp-apps/imrs.php?src=https://arc-anglerfish-washpost-prod-washpost.s3.amazonaws.com/public/3X7Q7B64NFKNZ7EYBD6R5PC23E_size-normalized.jpg&w=1440,"['https://news.google.com/dr/resources/images/generic-newsletter-signup.png', 'https://www.washingtonpost.com/wp-apps/imrs.php?src=https://s3.amazonaws.com/arc-authors/washpost/4d503e96-1ff7-4962-8fca-10f741753ad0.png&w=196&h=196', 'https://www.washingtonpost.com/wp-apps/imrs.php?src=https://arc-anglerfish-washpost-prod-washpost.s3.amazonaws.com/public/3X7Q7B64NFKNZ7EYBD6R5PC23E_size-normalized.jpg&w=1440']",[],https://news.google.com/rss/articles/CBMiW2h0dHBzOi8vd3d3Lndhc2hpbmd0b25wb3N0LmNvbS9wb2xpdGljcy8yMDI0LzAyLzI4L2JpZGVuLW1pY2hpZ2FuLXByaW1hcnktdW5jb21taXR0ZWQtZ2F6YS_SAQA?oc=5&hl=en-US&gl=US&ceid=US:en,2024-02-28,What the Michigan primary tells us about about November  The Washington Post,"Welcome to The Campaign Moment, your guide to the biggest developments in the 2024 election — and where we’ll never be “uncommitted” to you, dear reader. Also, with Super Tuesday less than a week away, please join us for a live chat about the big day with The Post’s polling director, Scott Clement, and polling analyst, Emily Guskin on Monday, March 4, at 1p.m. Eastern. Send your burning questions to them here.

(Did a friend forward this to you? If so, sign up here.)

Today, we’re left to put together the pieces of a couple of much-spun results in the Michigan presidential primary.

To recap: On the Republican side, Donald Trump continued his march to the nomination, but Nikki Haley still pulled roughly 27 percent as an effective protest vote. On the Democratic side, President Biden won even bigger, but about 13 percent of voters opted for “uncommitted,” in a more direct protest vote over his handling of Israel’s war in Gaza.

Advertisement

Neither is a game-changing result. But with a pair of front-runners whom the electorate is remarkably meh on — and with the general election having effectively begun — it matters which candidate has bigger problems with his base.

Let’s start with Biden and what the Gaza issue portends.

The big moment

To hear some tell it, Biden ceding more than 1 in 8 voters to “uncommitted” betrays a serious liability with his base in November — and the need to side more with the Palestinians’ cause. To hear others tell it, it’s pretty much a nothingburger.

The truth is somewhere in the middle. The defections were significant but far from a shock wave. This is clearly something Biden will have to mind — but mostly because Michigan is such a competitive state where even a minor shift could matter. And the war in Gaza, which both arouses huge passions and splits his party roughly in half, could play more of a role here than elsewhere.

Advertisement

The percentage of “uncommitted” votes on Tuesday was only slightly higher than it was in the last Michigan primary featuring an incumbent Democratic president, Barack Obama in 2012. Obama ceded 10.7 percent. He actually ceded even more votes to “uncommitted” or “no preference” that year in several other states.

The comparisons aren’t perfect, for reasons I broke down in my takeaways last night. This was obviously much more of a protest vote concerning a specific issue — and an issue that animates Biden’s left flank.

The question is whether people who lodge a protest vote in February might not still be punishing him over it — especially with Donald Trump likely the alternative — in November. We also don’t know what Biden’s stance might be on the war by the fall, and what the situation on the ground in Gaza will look like.

Advertisement

It’s very difficult to say how this affects November with any certainty; we don’t even have exit polls to tell us how many Democrats are threatening not to support Biden. (At least 1 in 5 voters have said that about Trump in Republican contests in Iowa, New Hampshire and South Carolina.)

But it’s hardly the only evidence that this could be a tough issue for Biden to massage in the months ahead. To wit:

The problem for Biden is that virtually any decision or statement he makes risks alienating at least one wing of his party.

If there’s some good news for Biden, it’s that this doesn’t yet appear to be a huge issue for lots of voters. The YouGov poll shows just 13 percent of Democrats “strongly” disapproved of his handling of the war. And even in that Fox News Michigan poll, just 24 percent labeled it an “extremely” important issue to them — less than among Republicans.

Advertisement

We don’t know how many of those people are dug in against Biden or view this as a tipping-point issue. Yes, Trump sides even more with Israel, so he’s not an obvious home for these voters. But there are third-party candidates more aligned with the Palestinians’ cause, and sometimes people lodge protest votes or stay home.

A small number of angry Democrats could matter greatly in a close race — in Michigan or elsewhere. But next to other Biden’s liabilities (his age/immigration) and Trump’s liabilities (his extremeness/his legal problems), it’s not clear this currently ranks terribly high.

What is clear is that it’s worth watching.

Trump’s suburban struggle moment

There were also plenty of protest votes on the Republican side, of course.

It’s not strictly comparable, given these votes were for an actual person (and established politician) by the name of Nikki Haley — whom voters might simply like better than Trump. But Trump is continuing to cede lots of votes.

Advertisement

And nowhere does Trump face bigger defections and questions than in the suburbs.

In Michigan, two of Trump’s worst counties were Washtenaw (44 percent Haley) and Oakland (33 percent Haley), just outside of Detroit. He also lost 34 percent in Grand Rapids-based Kent County and 36 percent in Kalamazoo County.

And even in his 20-point win in South Carolina on Saturday, Trump actually lost three counties by double digits — two in the Charleston area and Columbia-based Richland County.

It’s no secret that the Trump era has cost the GOP in the suburbs — owing in large part to his problems with educated voters. But it’s still been close in each of his two campaigns. Trump won the suburbs by four points in 2016, then lost them narrowly in 2020.

Recent polls suggest that might not hold up. A Marist College poll this month showed suburban voters disliked Trump 64-32 and favored Biden by 25 points. And a December New York Times/Siena College poll showed suburban voters disliked Trump 62-34 and favored Biden by 14 points.

Advertisement

Given the suburbs are roughly half the vote these days, this could matter greatly.

A moment when Super Tuesday went very wrong

Super Tuesday is nigh — more than a dozen states will vote March 5, and a third of GOP delegates are at stake — and that gives us a chance to share one of our favorite presidential primary stories.

The challenge of campaigning in multiple states is real, but in no case has it been more real than it was in 1984 for Gary Hart.

Aiming to recast the impending Democratic National Convention by sweeping the final of three “Super Tuesdays,” Hart’s campaign decided to dispatch his wife to California while he campaigned in New Jersey. At a later event, Hart reflected, “The good news for her is she campaigns in California and I campaign in New Jersey.”

“I got to hold a koala bear,” his wife said.

Advertisement

Hart responded: “I won’t tell you what I got to hold: samples from a toxic waste dump.”

Offense was taken at the seemingly tired New Jersey dig and stereotype. And while Hart had led in some New Jersey polls, Walter Mondale went on to win it by 15 points. His domination of the delegates there helped put an end to a very drawn-out race.

And if not for later events, this episode might be a bigger part of Hart’s political obituary.","{'href': 'https://www.washingtonpost.com', 'title': 'The Washington Post'}"
65e4453eb6e58c7773b6f24d,New York Democratic lawmakers reject proposed congressional map,https://www.washingtonpost.com/wp-apps/imrs.php?src=https://arc-anglerfish-washpost-prod-washpost.s3.amazonaws.com/public/Q7FEXSJGZJXV6OAKI5366EJFLM.JPG&w=1440,"['https://news.google.com/dr/resources/images/generic-newsletter-signup.png', 'https://www.washingtonpost.com/wp-apps/imrs.php?src=https://arc-anglerfish-washpost-prod-washpost.s3.amazonaws.com/public/Q7FEXSJGZJXV6OAKI5366EJFLM.JPG&w=1440']",[],https://news.google.com/rss/articles/CBMiWGh0dHBzOi8vd3d3Lndhc2hpbmd0b25wb3N0LmNvbS9wb2xpdGljcy8yMDI0LzAyLzI2L25ldy15b3JrLWRlbW9jcmF0cy1jb25ncmVzc2lvbmFsLW1hcC_SAQA?oc=5&hl=en-US&gl=US&ceid=US:en,2024-02-27,New York Democratic lawmakers reject proposed congressional map  The Washington Post,"Lawmakers in the Democratic-led New York state legislature Monday rejected a new congressional map proposed by an independent redistricting commission, the latest political twist in a state that could play a large role in determining which party wins control of the House. Cut through the 2024 election noise. Get The Campaign Moment newsletter. ArrowRight The New York Senate voted down the map proposal Monday afternoon, followed by the lower chamber.

The rejection of the map is likely to spark a legal challenge ahead of the state’s June 25 primary.

The proposed map was approved earlier this month by the New York State Independent Redistricting Commission. It would have made it easier for Democrats to flip at least one seat this year — that of Rep. Brandon Williams — but otherwise did not make any major changes to district lines used in 2022.

After the commission adopted the map, the district lines drew criticism from House Minority Leader Hakeem Jeffries (D-N.Y.), who is poised to become speaker if Democrats regain the majority. A spokesman for Jeffries said on Feb. 16 that state lawmakers needed to “meticulously” scrutinize the proposal, particularly whether it protected “historically under-represented communities.”

Advertisement

Democratic leaders in Albany had the option to pass the commission-approved map or try to advance another that is more favorable to their party.

After Republicans picked up four House seats in New York in 2022, the state is shaping up to again be pivotal in determining which party wins control of the House in November’s elections. Democrats need a net gain of four seats nationwide to retake the majority.

In a special election that many saw as a barometer for 2024, Democrats picked up a House seat for the rest of the congressional term earlier this month in New York when former congressman Tom Suozzi won the race to replace Republican George Santos, who was expelled from Congress late last year.

The New York congressional map has been under scrutiny since 2022, when Democrats drew one that was heavily favorable to themselves and the state’s highest court struck it down as unconstitutional.

After the votes Monday, the Republican leader of the New York Senate, Rob Ortt, said in a statement that Democrats were “once again poised to create their own gerrymandered maps in another shameful power grab.”","{'href': 'https://www.washingtonpost.com', 'title': 'The Washington Post'}"
