_id,title,top_image,images,videos,url,date,short_description,text,publisher
65e4453eb6e58c7773b6f236,Supreme Court divided over gun-rights challenge to Trump bump stock ban,https://www.washingtonpost.com/wp-apps/imrs.php?src=https://arc-anglerfish-washpost-prod-washpost.s3.amazonaws.com/public/G6P5MYSD2AHISEVV2VSQRFWR7E_size-normalized.jpg&w=1440,"['data:image/gif;base64,R0lGODlhAQABAIAAAAAAAP///yH5BAEAAAAALAAAAAABAAEAAAIBRAA7', 'data:image/svg+xml,%3csvg%20xmlns=%27http://www.w3.org/2000/svg%27%20version=%271.1%27%20width=%272048%27%20height=%271365%27/%3e', 'https://www.washingtonpost.com/wp-apps/imrs.php?src=https://s3.amazonaws.com/arc-authors/washpost/22b7b3de-a498-466e-bd9a-0f113ac28279.png&w=196&h=196', 'https://news.google.com/dr/resources/images/generic-newsletter-signup.png', 'https://www.washingtonpost.com/wp-apps/imrs.php?src=https://arc-anglerfish-washpost-prod-washpost.s3.amazonaws.com/public/G6P5MYSD2AHISEVV2VSQRFWR7E_size-normalized.jpg&w=1440', 'https://www.washingtonpost.com/wp-apps/imrs.php?src=https://arc-anglerfish-washpost-prod-washpost.s3.amazonaws.com/public/HDWKS62PWBHRTGGK6IKO6FJN4Q.jpg&w=1440']",[],https://news.google.com/rss/articles/CBMiVWh0dHBzOi8vd3d3Lndhc2hpbmd0b25wb3N0LmNvbS9wb2xpdGljcy8yMDI0LzAyLzI4L2J1bXAtc3RvY2stYmFuLXN1cHJlbWUtY291cnQtZ3Vucy_SAQA?oc=5&hl=en-US&gl=US&ceid=US:en,2024-02-28,Bump stock ban divides Supreme Court justices at oral argument  The Washington Post,"A divided Supreme Court seemed to struggle Wednesday with the legality of a federal ban on bump stock devices, which allow semiautomatic rifles to fire hundreds of bullets per minute. Liberal justices suggested the devices were exactly what Congress had in mind when it long ago imposed restrictions on machine guns. Some conservative justices, however, said the law’s language was not so clear.

The bump stock ban represents one of the few steps by the federal government to address the gun violence that has traumatized the United States, as both Congress and some courts have resisted other firearm restrictions. Although more than a dozen states and D.C. separately restrict the use of bump stocks, a ruling that tosses out the national ban would make the devices legal in many places and could make it more difficult for the federal government to limit access to other firearms and accessories.

Advertisement

Throughout oral argument Wednesday, several liberal and conservative justices expressed concern about dangerous weapons and the bloody damage that can be done by a rifle affixed with a bump stock. But it was not certain based on their questions whether the court, with its 6-3 conservative supermajority, would uphold the ban.

Justice Amy Coney Barrett, a conservative, said that while she is “entirely sympathetic” to the government’s argument, she has concerns that Congress’s law restricting access to machine guns did not clearly cover bump stocks. Justice Neil M. Gorsuch, also a conservative, said he can “certainly understand why these items should be made illegal” but suggested it would be up to lawmakers to do so explicitly.

Liberal Justice Ketanji Brown Jackson, in contrast, said bump stocks are “the kind of weapons that Congress was intending to prohibit because of the damage they cause.” Justice Elena Kagan, also a liberal, said the “torrent of bullets” fired by rifles equipped with the devices is “in the heartland” of what lawmakers were concerned about when they passed the statute.

Advertisement

Michael Cargill, a U.S. Army veteran and the owner of a gun store in Austin, challenged the Trump-era rules after he was forced to surrender two bump stocks. Cargill says the Bureau of Alcohol, Tobacco, Firearms and Explosives overstepped its authority when it reinterpreted long-standing federal limits on machine guns to cover the devices.

The case is one of two before the Supreme Court this term involving gun restrictions — and one of several cases challenging the power of federal agencies, long targeted by conservatives wary of what they consider government overregulation.

Cargill is represented by the New Civil Liberties Alliance, one of the conservative legal organizations that is also behind an effort to upend a 40-year-old court precedent known as Chevron, which often requires judges to defer to the expertise of agency officials when evaluating statutes.

Advertisement

Cargill’s lawsuit to recover his bump stock devices was filed before the Supreme Court’s landmark decision 2022 expanding gun rights by requiring the government to point to historical analogues when defending laws that limit Second Amendment rights. That ruling is at issue in the other gun case before the court this term, which questions the legality of a law barring gun ownership by individuals subject to domestic-violence protective orders.

The question before the court Wednesday, in contrast, did not directly involve the Second Amendment. Instead, the justices examined whether ATF officials properly interpreted a statute that has barred nonmilitary access to machine guns since 1986.

Much of the discussion centered on how a bump stock operates and whether its use amounts to a “single function of the trigger.” The argument was at various times a lesson in grammar, physics and the mechanics of firearms. During one exchange, Kagan and Cargill’s attorney, Jonathan Mitchell, took turns using their hands to demonstrate what it looks like to fire a gun affixed with the device.

Bump stocks are molded pieces of plastic or metal that replace the standard rifle stock that rests against a shooter’s shoulder. The device harnesses a gun’s natural recoil, allowing the rifle to bounce or “bump” rapidly back and forth off a shooter’s trigger finger. Rifles equipped with bump stocks can fire an estimated 400 to 800 bullets per minute, a rate comparable to military machine guns.

Advertisement

The National Firearms Act defines machine guns as firearms that shoot, are designed to shoot or can be readily restored to shoot “automatically more than one shot, without manual reloading, by a single function of the trigger” as well as any part designed and intended solely “for use in converting a weapon into a machinegun.”

The Biden administration, defending the Trump administration’s interpretation, told the court that the devices allow a rifle to fire more than one shot automatically and that a single motion initiates and maintains the firing.

“As long as the shooter maintains that steady forward pressure, the rifle will fire continuously until it runs out of bullets, and it will empty a 100-round magazine like the ones used in the Las Vegas shooting in about 10 seconds,” said Principal Deputy Solicitor General Brian Fletcher. “Those weapons do exactly what Congress meant to prohibit when it enacted the prohibition on machine guns.”

Advertisement

Mitchell, a former Texas solicitor general, vigorously disputed that description, saying the rapid fire is produced through repeated manual activations of the trigger — not a single motion.

A rifle equipped with a bump stock can fire “only one shot per function of the trigger because the trigger must reset after every shot and must function again before another shot can be fired,” he said.

ATF’s assessment of bump stock devices and interpretation of the law has changed over time. In 2003, the agency said an early version was not a machine gun because it did not fire more than one shot with a single function of the trigger. Three years later, the agency changed its position and classified the early model with an internal spring as a machine gun.

Cargill’s attorneys emphasize that for nearly a decade, between 2008 and 2017, the federal government did not count later versions of the devices — without the internal spring — as machine guns. During that time, Americans bought 520,000 bump stocks.

Advertisement

President Donald Trump’s bump stock ban gave owners until March 2019 to destroy or turn over their devices. Gorsuch and Justice Brett M. Kavanaugh expressed concern about the possibility that a half-million people could be prosecuted if they purchased the devices before the rules changed. But Fletcher sought to reassure them that ATF does not have the power to make something a crime that was not a crime before.

The two justices were among several conservatives who questioned the government’s evolving interpretation of the statute, with Kavanaugh noting that bump stocks were not banned during the administrations of Presidents George W. Bush and Barack Obama. Gorsuch questioned the Trump and Biden administrations’ decision to apply to bump stocks a statute first passed in the 1930s, even though other administrations thought differently.

Fletcher said ATF was correcting past mistakes, just as the Supreme Court often does when it decides a statute is being interpreted incorrectly.

Advertisement

“After the Las Vegas shooting, the deadliest shooting in our nation’s history, I think it would have been irresponsible for the ATF not to take another closer look at this prior interpretation,” Fletcher said.

The justices’ questions Wednesday did not always break along the familiar ideological lines. Justice Clarence Thomas noted that the statute was initially passed because of the lethality of machine guns. Behind the latest ban, he said, is the “notion that the bump stock does the exact same thing.”

Justice Samuel A. Alito Jr. asked Mitchell if he could imagine a legislator thinking Congress should ban machine guns but not bump stocks.

In reply, the attorney said bump stocks can help people who have disabilities and people who have arthritis in their fingers shoot their weapons. “There are respectable arguments for why these could remain legal as a matter of policy,” he said.

Advertisement

Justice Sonia Sotomayor quickly followed up, asking, “Why would even a person with arthritis, why would Congress think they needed to shoot 400 to 7 or 800 rounds of ammunition under any circumstance?”

The court’s conservatives are proponents of textualism — a method of interpretation that considers only the words of the law being reviewed, not legislators’ intent or the consequences of the decision. But there were varying opinions expressed by the justices about how to read this particular statute.

“Maybe they should have written something better. One might hope they might write something better in the future. But that’s the language we’re stuck with,” Gorsuch said, taking issue with the government’s reading of the text to include bump stocks.

Kagan said she too considers herself a “good textualist” but came to the opposite conclusion: that the statute must encompass the devices.

“Textualism is not inconsistent with common sense,” Kagan said. “At some point, you have to apply a little bit of common sense to the way you read a statute and understand that what this statute comprehends is a weapon that fires a multitude of shots with a single human action.”

Cargill’s challenge to the bump stock ban was rejected in district court and before a unanimous panel of the conservative U.S. Court of Appeals for the 5th Circuit.

But the 5th Circuit reversed that ruling after a full complement of judges reheard the case. An eight-judge majority concluded the definition of machine gun in the statute does not cover bump stocks in part because “to continue firing after the shooter pulls the trigger, he or she must maintain manual, forward pressure on the barrel and manual, backward pressure [with the trigger finger],” Judge Jennifer Elrod wrote.

Five other judges argued that the definition was ambiguous but said the court was required under a rule of interpretation in cases involving criminal law to resolve the matter in Cargill’s favor.

In dissent, Judge Stephen Higginson, joined by two colleagues, criticized the majority for invoking the rule to “rewrite a vital public safety statute” and to “legalize an instrument of mass murder.”

The Justice Department then asked the Supreme Court to intervene.","{'href': 'https://www.washingtonpost.com', 'title': 'The Washington Post'}"
65e4453eb6e58c7773b6f237,"On foreign policy, Mitch McConnell and Nikki Haley have lost out to Donald Trump",https://www.washingtonpost.com/wp-apps/imrs.php?src=https://arc-anglerfish-washpost-prod-washpost.s3.amazonaws.com/public/DZYFDO5OCAVA5MVHIO6Z6ADGMM.JPG&w=1440,"['https://www.washingtonpost.com/wp-apps/imrs.php?src=https://arc-anglerfish-washpost-prod-washpost.s3.amazonaws.com/public/DZYFDO5OCAVA5MVHIO6Z6ADGMM.JPG&w=1440', 'https://news.google.com/dr/resources/images/generic-newsletter-signup.png', 'https://www.washingtonpost.com/wp-apps/imrs.php?src=https://s3.amazonaws.com/arc-authors/washpost/a0bd4956-a3b9-4655-a6ab-cf2d0914486b.png&w=196&h=196']",[],https://news.google.com/rss/articles/CBMiZGh0dHBzOi8vd3d3Lndhc2hpbmd0b25wb3N0LmNvbS9wb2xpdGljcy8yMDI0LzAzLzAyL21pdGNoLW1jY29ubmVsbC1uaWtraS1oYWxleS10cnVtcC1mb3JlaWduLXBvbGljeS_SAQA?oc=5&hl=en-US&gl=US&ceid=US:en,2024-03-02,"On foreign policy, Mitch McConnell and Nikki Haley have lost out to Donald Trump  The Washington Post","Senate Republican leader Mitch McConnell (R-Ky.) and former South Carolina governor Nikki Haley have spent the first months of this election year fighting losing battles — separate but related. Their losses highlight the victory of Donald Trump’s “America First” over Ronald Reagan’s “tear down this wall” as the foreign policy doctrine of the Republican Party.

Trump’s reshaping of the Republican Party has been an evolving story. As president, he embraced some traditional Republican positions, for example on tax cuts for the wealthy. But he moved the party from one that pushed for free trade to one that pushed tariffs. Rather than trying to rein in government, he spent freely and allowed the national debt to balloon.

Nowhere, however, has his influence been more pronounced and potentially consequential than in what has become a full reversal of the internationalism that was central to Republican orthodoxy through most of the post-World War II era. Both McConnell in his role in the Senate and Haley as Trump’s last remaining challenger for the GOP nomination for president have vigorously opposed this part of Trump’s policy prescriptions.

Advertisement

Haley has lost contests to Trump in one state after another, but has refused to do what Trump had expected, which was to graciously concede defeat and step to the sidelines. She faces another brutal series of contests in the coming days, with 15 alone on Super Tuesday, which are likely to add significantly to Trump’s growing delegate lead.

She has said Trump was the right president at the right time. She agrees with many of his domestic politics, though not his fiscal stance. She served in his administration as United Nations ambassador. She has stepped up her criticism of him as a man unhinged. Where she parts company most emphatically is on the question of America’s role in the world.

She likes to say “the world is on fire,” with conflicts in Ukraine and the Middle East and brewing problems elsewhere. She advocates more military aid for Ukraine and argues against Trump’s “America First” worldview. Her argument, shared by others, is that a retreat by the United States from a leadership role in the world leaves both this country and the world at large less safe in the face of threats from Russia, China, Iran and North Korea.

Advertisement

She harks back to a different Republican Party, a party that has been in retreat since Trump first ran for president. She wins votes — 20 percent or 30 percent or even 40 percent in states where she has competed — but she is not winning the argument.

If the next round of primaries goes as expected, with Trump triumphant, Haley will face more calls to withdraw. She has been defiant in resisting those calls to date, marching to the beat of her own drum. But to what end? For there is little to suggest that she can now or in the near future arrest the inward turn within her party.

McConnell announced on Wednesday that he will step down as Senate leader in November, ending the longest run as a party leader in the Senate’s history. Many factors contributed to the decision, including his age and his health as well as a painful family loss.

Advertisement

But McConnell was clear in acknowledging that there was more than a losing battle against Father Time that brought him to the decision. “Believe me, I know the politics within my party at this particular moment in time,” he said in announcing his decision. “I have many faults. Misunderstanding politics is not one of them.”

Like Haley, McConnell agreed with Trump on many issues, especially for what will be remembered as McConnell’s most significant and controversial accomplishment: the remaking of the federal judiciary and the Supreme Court. This was as much or more a McConnell initiative as a Trump priority.

McConnell’s hardball tactics in that fight will not be forgotten. He balked at filling one vacancy in 2016 while President Barack Obama was still in office, refusing even to allow a hearing on Obama’s nominee, current Attorney General Merrick Garland. That gave Trump the opportunity to nominate conservative Justice Neil M. Gorsuch in early 2017.

Advertisement

Weeks before the 2020 election, McConnell rammed through another Trump nominee, Amy Coney Barrett. In between, Trump nominated and McConnell helped facilitate the confirmation of Justice Brett M. Kavanaugh.

That 6-3 conservative majority produced the most politically explosive decision of recent times in 2022, the case of Dobbs v. Jackson Women’s Health Organization, which overturned Roe v. Wade and ended half a century of the constitutional right to an abortion.

By his actions, McConnell endeared himself to conservatives but became a reviled figure, particularly on the left, leaving a permanent scar on his legacy. And yet, for all he did with regard to the judiciary, his increasingly open disdain for Trump and Trump’s petulant hostility toward him have left him isolated within his party.

His missed opportunity to prevent Trump from running in 2024 came when he voted to acquit the former president in the impeachment trial resulting from the Jan. 6, 2021, storming of the Capitol, despite excoriating Trump for his role in the attack after the acquittal.

Advertisement

McConnell was elected to the Senate in 1984, the same year Reagan scored a landslide reelection victory. He has seen the world through the prism of the Reagan doctrine, which espoused the need for robust U.S. leadership in the world. Reagan successfully challenged the Soviet Union, leading to his memorable call to Soviet leader Mikhail Gorbachev to tear down the Berlin Wall. The wall came down after Reagan left office, and the Soviet Union collapsed soon after. That is the world in which McConnell was shaped.

The Trump doctrine is the reverse of the Reagan doctrine — a pulling back from world leadership, an insular rather than an expansive view of the United States, a feeling that others should shoulder the burden, and even a belief that the United States has been used and abused by its allies.

Rather than challenging the Russians, Trump long has cozied up to Russian President Vladimir Putin. He has hectored leaders of allied nations and offered praise to authoritarian leaders who have risen around the world.

Advertisement

Most notably, he has repeatedly denigrated the NATO alliance, which has been a bulwark against Soviet and later Russian aggression. Recently, he offered a green light to the Russians to “do whatever the hell they want” to NATO countries that don’t spend enough on defense.

Statements like that are the reason there is as much concern among U.S. allies about what a second Trump presidency would mean for them and for the world at large.

Today, one big issue that separates both McConnell and Haley from Trump is Ukraine and whether the United States will maintain its commitment to help supply that nation with the arms and other equipment needed to continue its resistance in the face of Russia’s invasion two years ago.

McConnell and Haley believe it is essential to do so. The followers of Trump resist. Opposition among elected officials is stronger in the House, where Republicans more directly reflect — or accept — Trump’s “America First” views.

Advertisement

But even in McConnell’s Senate, many senators appear to stand closer to Trump. When the Senate approved the $95 billion package for Ukraine, Israel and other U.S. allies, McConnell voted in favor but 26 of his Republican colleagues voted no.

McConnell said he plans to serve out his current term, which ends in early 2027. As a former leader, he will have more freedom to speak for himself, but will his voice resonate with the power it once had? Haley has given no indication of what will follow her campaign for the presidency. Will she use her voice to continue to challenge Trump’s foreign policy views, especially if he wins in November, in the hope of rebuilding a consensus for Reaganism?","{'href': 'https://www.washingtonpost.com', 'title': 'The Washington Post'}"
