_id,title,top_image,images,videos,url,date,short_description,text,publisher
65e4453eb6e58c7773b6f203,Why Trump’s effort to run out the clock in federal election case is working,https://www.washingtonpost.com/wp-apps/imrs.php?src=https://arc-anglerfish-washpost-prod-washpost.s3.amazonaws.com/public/XT44XOQFYAI6ZM6EYRRLD3OPZA.jpg&w=1440,"['https://www.washingtonpost.com/wp-apps/imrs.php?src=https://s3.amazonaws.com/arc-authors/washpost/18aacda4-9270-4380-a185-cea1a5506d98.png&w=196&h=196', 'https://www.washingtonpost.com/wp-apps/imrs.php?src=https://arc-anglerfish-washpost-prod-washpost.s3.amazonaws.com/public/XT44XOQFYAI6ZM6EYRRLD3OPZA.jpg&w=1440', 'https://news.google.com/dr/resources/images/generic-newsletter-signup.png']",[],https://news.google.com/rss/articles/CBMiX2h0dHBzOi8vd3d3Lndhc2hpbmd0b25wb3N0LmNvbS9wb2xpdGljcy8yMDI0LzAyLzI5L3RydW1wLXN1cHJlbWUtY291cnQtaW1tdW5pdHktZWxlY3Rpb24tdHJpYWwv0gEA?oc=5&hl=en-US&gl=US&ceid=US:en,2024-02-29,Analysis | Why Trump's effort to run out the clock in federal election case is working  The Washington Post,"All of this began in the early morning hours of Nov. 4, 2020. After polls closed on Election Day, Donald Trump could have accepted that American voters had opted to replace him. He could have ignored the months of groundwork laid to claim that the election was stolen and admit that it wasn’t. But he did not. In the middle of the night, he told reporters and America that he’d won — and he spent the next two months in an unsuccessful effort to manifest that falsehood.

For a long time, he escaped significant accountability. He was impeached by the House in 2021 but Senate Republicans voted against convicting him following the trial. A civil suit brought in 2021 by police officers who were at the Capitol riot crept through the legal system and remains unresolved. The House select committee investigating his actions after the election cobbled together a detailed picture of how he’d tried to retain power — but then Republicans won the 2022 midterms and the committee quickly wrapped up.

Advertisement

Then, in August 2023, special counsel Jack Smith obtained a federal criminal indictment against Trump for his efforts to retain power. The stage was set for Trump to have to account for his actions; there were 15 months during which his response to the 2020 election could be adjudicated before the next presidential election in 2024.

But, again, the process moved slowly — and will now move more slowly still.

On Wednesday, the Supreme Court announced that it would consider Trump’s primary delay tactic: an argument that he had broad immunity for his actions because of his position. It’s an argument that’s been rejected multiple times in various venues previously and one that most independent observers view as invalid. The Supreme Court will probably (though by no means certainly) agree. But, thanks to how this has unfolded, Trump’s 2020 actions will probably not be adjudicated by the time voters go to the polls in November — which may render the whole thing irrelevant.

Again, this story begins on Election Day in 2020. Trump fought his loss with every tool at his disposal but failed to remain in office. In July 2021, following a June 30 vote, the Democratic-led House initiated the select committee to probe the riot at the Capitol six months before — and, more broadly, Trump’s post-election actions. The month after the committee was formed, six police officers filed a civil suit against Trump.

Advertisement

The committee did its work and held its hearings. By November 2022, though, the writing was on the wall: Republicans were likely to retake the House majority and dissolve the investigation. After the midterms, the committee issued a final report, about a month after Trump announced that he would seek the presidency again in 2024.

The Supreme Court's decision to hear former president Donald Trump's immunity case increases the chances his federal trial is pushed close to the 2024 election. (Video: JM Rieger/The Washington Post, Photo: Jabin Botsford/The Washington Post)

Meanwhile, the Justice Department had already started building a case against Trump. In late 2021, investigators were already subpoenaing people tied to Trump’s effort. As the House committee’s work progressed, the Justice Department sought copies of its interview transcripts. When Trump announced that he was seeking the 2024 Republican nomination, Attorney General Merrick Garland transitioned the existing probe to special counsel Jack Smith, offering a layer of distance from the Biden administration.

In August, Smith obtained the indictment in D.C. In early October, Trump argued that the case should be dismissed because he had immunity for his actions as president. Smith, as you might expect, disagreed.

Advertisement

Trump had already tried this tack in the civil case, without success. But it was obvious from early on that Trump saw the 2024 election as a central element of his legal fight: if he could be elected president — or maybe even just run — he could derail the federal government’s efforts to hold him criminally liable. Injecting this idea that he had immunity was, if nothing else, a way to slow the legal process.

The judge overseeing the D.C. case, Tanya S. Chutkan, rejected Trump’s argument — coincidentally on the same day that the D.C. Circuit Court of Appeals rejected his immunity claim in the civil trial. It didn’t take long for Trump to appeal Chutkan’s decision to that same appeals court.

Smith asked the Supreme Court to intervene, as a means of resolving the immunity question over the short term. Chutkan issued a stay on the criminal case while the immunity argument was being considered, meaning that no trial could move forward in the interim. The Circuit Court agreed to move quickly. Three days before Christmas, the Supreme Court rejected the request to jump in.

Advertisement

Earlier this month, the Circuit Court ruled against Trump’s immunity claim. Trump appealed that decision to the Supreme Court on Feb. 12. Smith asked the court to decide quickly.

“The charged crimes strike at the heart of our democracy,” he wrote in a response to Trump’s claims. “A President’s alleged criminal scheme to overturn an election and thwart the peaceful transfer of power to his successor should be the last place to recognize a novel form of absolute immunity from federal criminal law.”

He did not need to mention that Trump was again hoping to gain power through a democratic election.

On Wednesday, the court agreed to consider the case. Trump needs to present a brief by March 19 and Smith to respond by April 8. Oral arguments are scheduled for the week of April 22.

So the question becomes: Then what?

Advertisement

After the Circuit Court rejected Trump’s immunity claim, Just Security published a detailed article explaining its expectations on time frames. If the court agreed to hear the case, Norm Eisen, Matthew Seligman and Joshua Kolb hypothesized, arguments were likely to be heard in late March with a decision in mid-April. But we know now that predicted timeline was optimistic: instead, the court won’t hear arguments until Just Security figured they’d have handed down a ruling. The court’s current session ends in late June, meaning that a decision on immunity would, at the very latest, land then or in early July.

Now we apply the other estimates from Just Security: that there are still three months of pretrial considerations to work through and then a probable three-month trial. That means that, assuming a late-June Supreme Court decision, pretrial activity would be gearing up as the Republican Party holds its nominating convention in July. The trial might begin in late September — finishing at the end of the year.

There is no prohibition — formal or otherwise — about trying a political candidate before an election. But Trump would be expected to make political hay of the circumstances, arguing that a trial would be a form of election interference. Perhaps the court would resist such arguments and perhaps the preparations for and the trial itself would move faster than three months each. But the odds are slim and getting slimmer that the question of Trump’s criminality in attempting to retain power will be settled before voters are asked whether to return that power to him.

If he loses in November, none of this matters. His trial will continue and his guilt determined. But if he wins? He becomes president and could attempt to pardon himself. Accountability evaporates.","{'href': 'https://www.washingtonpost.com', 'title': 'The Washington Post'}"
65e4453eb6e58c7773b6f204,Russia looms over yet another Trump presidential campaign,https://www.washingtonpost.com/wp-apps/imrs.php?src=https://arc-anglerfish-washpost-prod-washpost.s3.amazonaws.com/public/RANTNRKWUW3JXKAD7WNQ2RNYIY.JPG&w=1440,"['https://www.washingtonpost.com/wp-apps/imrs.php?src=https://arc-anglerfish-washpost-prod-washpost.s3.amazonaws.com/public/RANTNRKWUW3JXKAD7WNQ2RNYIY.JPG&w=1440', 'https://www.washingtonpost.com/wp-apps/imrs.php?src=https://s3.amazonaws.com/arc-authors/washpost/1349d1a8-ce7e-4ef4-8c16-36962da3ade8.jpg&w=196&h=196', 'https://news.google.com/dr/resources/images/generic-newsletter-signup.png']",[],https://news.google.com/rss/articles/CBMiRmh0dHBzOi8vd3d3Lndhc2hpbmd0b25wb3N0LmNvbS9wb2xpdGljcy8yMDI0LzAyLzI2L3RydW1wLXJ1c3NpYS1wdXRpbi_SAQA?oc=5&hl=en-US&gl=US&ceid=US:en,2024-02-26,Russia looms over yet another Trump presidential campaign  The Washington Post,"In February alone, Donald Trump encouraged Russia “to do whatever the hell they want” to NATO allies that do not contribute sufficiently to the military alliance. He refused to condemn Russian President Vladimir Putin for the death of Alexei Navalny, 47, a Kremlin critic who died suddenly on Feb. 16 in a Russian penal colony — instead likening himself to Navalny, arguing they were both political prisoners.

And in a Fox News town hall Tuesday evening, he praised Russia for being “a war machine.”

“They defeated Hitler,” Trump declared, apparently referring to the Soviet Union’s role in World War II.

Since he announced his first presidential campaign in 2015, Russia has followed Trump like an unshakable thunder cloud. The former president has repeatedly expressed a fascination with Russia, lavished praise on Putin and refused to stand up to the Russian president on a range of issues — from interfering in the 2016 presidential election to invading Ukraine almost exactly two years ago.

Advertisement

Trump’s reluctance to forcefully confront Russia and his regular adulation of Putin have long raised the question: With Trump, why do “all roads lead to Putin?” as then-Speaker Nancy Pelosi (D-Calif.) memorably asked in 2019 during a contentious Cabinet Room meeting.

His latest round of pro-Russian cheerleading raises the same question — but now against a dramatically changed backdrop. The Russia-Ukraine war is entering its third year, with no signs of abating. Putin critics are calling the death of Navalny — who had survived a previous Russian attempt to poison him — a murder. And under Trump’s leadership, the Republican Party has drifted in a remarkably isolationist direction on foreign policy, with House Republicans currently holding up much-needed aid to Ukraine.

“His buddy-buddy — whatever it happens to be — affection with Putin is dangerous — to our transatlantic alliance, to NATO, to our support of people fighting for democracy in Ukraine,” Pelosi said.

Advertisement

“The Navalny assassination is something that is so startling and so blatant, and to see the former president’s comment about it just continues us on the path of: What is his connection to Russia?” she added.

Both Russia experts and some Trump confidants say the answer is far more straightforward than some of the existing theories, including the theory that the Russians have damaging material — known as kompromat — on Trump and are using it to blackmail him.

Rather, they say, the former president simply likes dictators and strongmen like Putin.

“My explanation is he just likes these big guys who did what they wanted to do, and he wanted to be a big guy who does what he wants to do,” said John Bolton, Trump’s former national security adviser who has since become an outspoken Trump critic.

Bolton described a broad “pattern of behavior,” pointing to Trump’s friendliness and fascination with other authoritarian leaders, such as Recep Tayyip Erdogan of Turkey, Kim Jong Un of North Korea, Viktor Orban of Hungary and Xi Jinping of China.

Trump, Bolton added, “had difficulty with a lot of democratically elected foreign leaders, particularly women,” and would sometimes refer to Xi as “king” — “because he was so impressive, so much in charge of China,” he said.

Michael McFaul, ambassador to Russia under President Barack Obama, similarly said that Trump admires strongmen leaders, but added that the former president also seems to genuinely share a similar governing philosophy with some of these authoritarians.

Advertisement

“There is a kind of ideological affinity between them, and there’s a kind of transnational movement of these populist nationalists, and the things that Trump says and the things that Putin says are very similar,” McFaul said. “I don’t think it’s just Trump mimicking Putin. I think that’s their shared worldview, and there’s millions of people who have that view.”

A former senior adviser to Trump, speaking on the condition of anonymity to share a candid assessment, added that Trump was simply “envious of dictators.” This person added that “10 times a day, maybe,” he and other top advisers tried to explain to Trump that Putin was dangerous and a threat to U.S. interests, but Trump was taken by Putin’s “tough guy image.”

“Putin and the other ones just worked him,” this person said. “It’s a vanity thing with him. It’s a tough guy thing. As long as you’re playing to those weaknesses, he’s going to think a lot of you.”

Advertisement

The Trump campaign rejected the notion that the former president was soft in his dealings with Putin. The campaign pointed to recent comments from the Russian president in which he said he preferred President Biden to Trump, describing Biden as “more experienced,” “more predictable” and “an old-school politician.”

“Vladimir Putin recently endorsed Joe Biden for president because he knows Biden is weak and can easily be bullied, as evidenced by Putin’s years-long invasion of Ukraine,” Trump spokeswoman Karoline Leavitt said in a statement. “When President Trump was in the Oval Office, Russia and all of America’s adversaries were deterred, because they feared how the United States would respond.”

Yet Trump and Putin’s relationship remains especially complicated. The U.S. intelligence community, a bipartisan Senate panel and a two-year investigation by special counsel Robert S. Mueller III all found that Russia interfered in the 2016 U.S. presidential election.

Advertisement

Russia’s efforts to interfere were “sweeping and systematic,” Mueller found.

But Trump has refused to acknowledge that reality, repeatedly dismissing it as the “Russia hoax” and a political “witch hunt” meant to hurt him. Some people close to him privately say that he cannot disentangle his personal animosity and feelings of persecution over the fallout from Russia’s election interference with his foreign policy stances toward the country.

“For him, the idea that Russia interfered on his behalf undercuts his great win,” said Fiona Hill, who served as senior director for European and Russian affairs on the National Security Council during the first two years of the Trump administration. “He was always saying, ‘No, no, I won. I had a great win.’ He also didn’t want to be humiliated on behalf of Putin.”

She added: “If Putin actually did say to him, ‘You know, Donald, we did steal the election for you,’ he’d just implode because it undercuts his idea of being a winner.”

Regardless of Trump’s motivations, his policies also have supporters. Justin Logan, director of defense and foreign policy studies at the Cato Institute, described the Biden administration’s stance toward Ukraine as amounting to “a forever war, in practice.”

Advertisement

“A lot of Republican voters are asking themselves, ‘Does the administration or does anybody have a plausible theory of victory here?’ and I think it’s very easy to answer that question in the negative,” Logan said. “We’re just going to keep spending until Russia is bled white, and I think that’s not a great plan from the point of view of the American taxpayer.”

Edward King, founder and president of Defense Priorities, a foreign policy think tank, praised Trump for “at the very least getting the attention of Europeans” when it comes to NATO.

“Absolutely I’m in favor of rethinking the U.S. role in NATO,” King said. “I’m skeptical of permanent alliances, because that offers all sorts of trouble in the form of entanglements and getting involved in conflicts because of our relationships with countries rather than a sober look at U.S. security interests.”

Advertisement

Yet Trump’s ties with and behavior toward Russia — dating back to his days as a New York developer, eager to expand his empire to Moscow — have long raised concerns from fellow world leaders, Democratic lawmakers, his own national security team and even, at times, some of his fellow Republicans.

In June 2016, Trump’s oldest son, Donald Trump Jr., met at Trump Tower in New York with Russians promising dirt on his dad’s Democratic opponent, Hillary Clinton — and Trump later personally dictated the misleading statement that his son initially put out about the meeting.

At a news conference the following month, Trump publicly called on Russia to hack Clinton’s emails, saying, “Russia, if you’re listening, I hope you’re able to find the 30,000 emails that are missing.”

Once elected, Trump’s bromance with Putin continued. In May 2017, Trump shared highly classified information with the Russian foreign minister and ambassador during an Oval Office meeting, prompting both current and former U.S. officials to warn that Trump’s revelations jeopardized a key source of intelligence on the Islamic State.

Advertisement

Trump also repeatedly threatened to upend the NATO alliance — long a Putin goal. And at a 2018 summit in Helsinki, Trump met privately with Putin for two hours, joined only by their interpreters, before appearing at a news conference and siding with the Russian president over his own intelligence agencies on the issue of Russia’s election interference.

The Helsinki summit was hardly an aberration; throughout his presidency, Trump regularly worked to conceal details of his meetings and conversations with Putin from his own senior advisers.

His behavior continued once he left office. In February 2022, for instance, as Putin commenced his invasion of Ukraine, Trump described Putin and his aggression as “genius” and “pretty savvy.”

Most recently, he seemed to invite Russia to invade NATO counties that fall short of targets for military spending, again criticizing allied nations for not sufficiently contributing to NATO’s shared defense.

Alexander S. Vindman, who served as director of European and Russian affairs for the National Security Council during Trump’s presidency, said he fears that Putin sees Trump’s recent comments and views them as an opportunity to further ramp up Russian hostility in Ukraine — and elsewhere.

“He is signaling what a future in a second Trump administration would be like, which is friendly to our enemies and hostile to our friends,” Vindman said. “From Russia’s perspective, that is an optimal scenario.”

It is unclear if Trump’s embrace of Russia and reluctance to help Ukraine is a winning issue politically. Polls consistently show that about one-third of Americans say the United States is doing too much to help Ukraine, while most say the United States is doing the right amount or not doing enough.

A February ABC News-Ipsos poll found Americans roughly split between whether they trusted Biden (33 percent) or Trump (36 percent) more to do a better job handling the war between Ukraine and Russia. An additional 28 percent said neither, and 4 percent said they trusted both equally.

And a Quinnipiac University poll released last week found that 56 percent of registered voters support sending more military aid to Ukraine for its efforts in the war against Russia. The same poll found 47 percent approved of the way Biden is handling the response to Russia’s invasion, higher than the 40 percent who approve of his overall job performance.

McFaul said Trump’s pro-Russian comments could reverberate with Ukrainian Americans, as well as other voters who have family still living in Eastern Europe.

“You won’t be surprised that they were outraged by those comments, and there are people from those countries that live in states like Pennsylvania and Michigan and Wisconsin,” he said.

Dan Pfeiffer, a former Obama senior adviser, said that while “a lot of Trump’s palling around with Putin is baked in the cake,” it also provides Democrats with a real opportunity heading into the presidential election.

“Trump is running as a strong man, and it is essential when you’re running against a would-be strongman to reveal their weakness, and this month, with his comments about Putin, is a great opportunity to do that,” Pfeiffer said.

Already, the Biden campaign has seized on Trump’s recent remarks. A minute-long ad airing in Michigan, Pennsylvania and Wisconsin features Trump’s comments encouraging Russia “to do whatever the hell they want,” before a narrator intones: “No president has ever said anything like it. It’s shameful. It’s weak. It’s dangerous. It’s un-American.”

And after Trump’s comments during the Fox News town hall, where he again did not forcefully defend the NATO alliance, the Biden campaign blasted out a statement criticizing him for “empowering Putin.”

“Trump is a weak leader — someone who doesn’t understand the power of democracy here at home or across the globe,” the statement read.

One aspect of Trump’s stance on Russia has remained remarkably consistent: Its ability to alarm U.S. allies.

Hill, a senior fellow at the Brookings Institution, said Trump and Russia was what everyone was talking about at the recent Munich Security Conference, during which news of Navalny’s death emerged.

“It’s all anybody ever asks: ‘Is he coming back, and what does it mean?’” Hill said, repeating the queries she fielded about Trump in Munich. “They just keep asking the same question, and they keep getting the same answer: ‘Yeah, he could come back, and it means you need to get your act together.’”","{'href': 'https://www.washingtonpost.com', 'title': 'The Washington Post'}"
