_id,title,top_image,images,videos,url,date,short_description,text,publisher
65e513224390593f61fbae19,Donors Keep Pouring Millions Into Nikki Haley's Long-Shot Campaign - The Wall Street Journal,https://www.wsj.com/politics/elections/biden-campaign-reports-42-million-in-january-fundraising-8e477187/favicon.ico,[],[],https://www.wsj.com/politics/elections/biden-campaign-reports-42-million-in-january-fundraising-8e477187,2024-02-21,Donors Keep Pouring Millions Into Nikki Haley's Long-Shot Campaign  The Wall Street Journal,Donors Keep Pouring Millions Into Nikki Haley's Long-Shot Campaign  The Wall Street Journal,"{'href': 'https://www.wsj.com', 'title': 'The Wall Street Journal'}"
65e513224390593f61fbae33,Five Marines Confirmed Dead After Helicopter Crash in California - The Wall Street Journal,https://www.wsj.com/politics/national-security/marines-confirmed-dead-helicopter-crash-california-af94775b/favicon.ico,[],[],https://www.wsj.com/politics/national-security/marines-confirmed-dead-helicopter-crash-california-af94775b,2024-02-08,Five Marines Confirmed Dead After Helicopter Crash in California  The Wall Street Journal,Five Marines Confirmed Dead After Helicopter Crash in California  The Wall Street Journal,"{'href': 'https://www.wsj.com', 'title': 'The Wall Street Journal'}"
65e513224390593f61fbae42,"Biden's Age Back in Spotlight After Special Counsel Report, Verbal Flubs - The Wall Street Journal",https://www.wsj.com/politics/bidens-age-back-in-spotlight-after-special-counsel-report-verbal-flubs-159c77f5/favicon.ico,[],[],https://www.wsj.com/politics/bidens-age-back-in-spotlight-after-special-counsel-report-verbal-flubs-159c77f5,2024-02-09,"Biden's Age Back in Spotlight After Special Counsel Report, Verbal Flubs  The Wall Street Journal","Biden's Age Back in Spotlight After Special Counsel Report, Verbal Flubs  The Wall Street Journal","{'href': 'https://www.wsj.com', 'title': 'The Wall Street Journal'}"
65e513224390593f61fbadfc,Mitch McConnell to Quit as Top Senate Republican as Party Shifts Toward Trump - The Wall Street Journal,https://www.wsj.com/politics/policy/mitch-mcconnell-to-step-down-as-senate-minority-leader-in-november-7e9ca478/favicon.ico,[],[],https://www.wsj.com/politics/policy/mitch-mcconnell-to-step-down-as-senate-minority-leader-in-november-7e9ca478,2024-02-29,Mitch McConnell to Quit as Top Senate Republican as Party Shifts Toward Trump  The Wall Street Journal,Mitch McConnell to Quit as Top Senate Republican as Party Shifts Toward Trump  The Wall Street Journal,"{'href': 'https://www.wsj.com', 'title': 'The Wall Street Journal'}"
65e513224390593f61fbae14,How Trump Turned Conservatives Against Helping Ukraine - The Wall Street Journal,https://www.wsj.com/politics/elections/how-trump-turned-conservatives-against-helping-ukraine-d9f75b3b/favicon.ico,[],[],https://www.wsj.com/politics/elections/how-trump-turned-conservatives-against-helping-ukraine-d9f75b3b,2024-02-23,How Trump Turned Conservatives Against Helping Ukraine  The Wall Street Journal,How Trump Turned Conservatives Against Helping Ukraine  The Wall Street Journal,"{'href': 'https://www.wsj.com', 'title': 'The Wall Street Journal'}"
65e513224390593f61fbae2c,Rep. Jim Clyburn Will Step Down From Democratic Leadership - The Wall Street Journal,www.wsj.com/favicon.ico,[],[],https://www.wsj.com/politics/rep-jim-clyburn-will-step-down-from-democratic-leadership-549f7530,2024-02-14,Rep. Jim Clyburn Will Step Down From Democratic Leadership  The Wall Street Journal,Rep. Jim Clyburn Will Step Down From Democratic Leadership  The Wall Street Journal,"{'href': 'https://www.wsj.com', 'title': 'The Wall Street Journal'}"
65e513224390593f61fbae37,Biden Classified Document Probe: Five Revelations From the Special Counsel's Report - WSJ - The Wall Street Journal,https://www.wsj.com/politics/national-security/joe-biden-classified-document-case-revelations-3db06ca6/favicon.ico,[],[],https://www.wsj.com/politics/national-security/joe-biden-classified-document-case-revelations-3db06ca6,2024-02-09,Biden Classified Document Probe: Five Revelations From the Special Counsel's Report - WSJ  The Wall Street Journal,Biden Classified Document Probe: Five Revelations From the Special Counsel's Report - WSJ  The Wall Street Journal,"{'href': 'https://www.wsj.com', 'title': 'The Wall Street Journal'}"
65e513224390593f61fbae3d,Why Both Parties Have Shifted Right on Immigration—and Still Can't Agree - The Wall Street Journal,https://www.wsj.com/politics/policy/senate-border-vote-immigration-policies-trump-19977804/favicon.ico,[],[],https://www.wsj.com/politics/policy/senate-border-vote-immigration-policies-trump-19977804,2024-02-03,Why Both Parties Have Shifted Right on Immigration—and Still Can't Agree  The Wall Street Journal,Why Both Parties Have Shifted Right on Immigration—and Still Can't Agree  The Wall Street Journal,"{'href': 'https://www.wsj.com', 'title': 'The Wall Street Journal'}"
65e513224390593f61fbae40,Nikki Haley Asks for Secret Service Protection After Increase in Threats - The Wall Street Journal,https://www.wsj.com/politics/elections/nikki-haley-asks-for-secret-service-protection-after-increase-in-threats-05b67a22/favicon.ico,[],[],https://www.wsj.com/politics/elections/nikki-haley-asks-for-secret-service-protection-after-increase-in-threats-05b67a22,2024-02-05,Nikki Haley Asks for Secret Service Protection After Increase in Threats  The Wall Street Journal,Nikki Haley Asks for Secret Service Protection After Increase in Threats  The Wall Street Journal,"{'href': 'https://www.wsj.com', 'title': 'The Wall Street Journal'}"
65e513224390593f61fbadea,Almost Everything Is Going Trump's Way—Except Financially - The Wall Street Journal,https://www.wsj.com/politics/elections/almost-everything-is-going-trumps-wayexcept-financially-3dcba082/favicon.ico,[],[],https://www.wsj.com/politics/elections/almost-everything-is-going-trumps-wayexcept-financially-3dcba082,2024-03-02,Almost Everything Is Going Trump's Way—Except Financially  The Wall Street Journal,Almost Everything Is Going Trump's Way—Except Financially  The Wall Street Journal,"{'href': 'https://www.wsj.com', 'title': 'The Wall Street Journal'}"
65e513224390593f61fbadf2,Shutdown Fears Fade After White House Meeting - The Wall Street Journal,https://www.wsj.com/politics/policy/shutdown-deadline-tests-house-speaker-mike-johnson-f622dd65/favicon.ico,[],[],https://www.wsj.com/politics/policy/shutdown-deadline-tests-house-speaker-mike-johnson-f622dd65,2024-02-27,Shutdown Fears Fade After White House Meeting  The Wall Street Journal,Shutdown Fears Fade After White House Meeting  The Wall Street Journal,"{'href': 'https://www.wsj.com', 'title': 'The Wall Street Journal'}"
65e513224390593f61fbae01,President's Physical Gives Only Partial View of Commander in Chief's Health - The Wall Street Journal,https://www.wsj.com/politics/presidents-physical-offers-only-partial-window-into-the-health-of-commander-in-chief-ffe653ed/favicon.ico,[],[],https://www.wsj.com/politics/presidents-physical-offers-only-partial-window-into-the-health-of-commander-in-chief-ffe653ed,2024-02-28,President's Physical Gives Only Partial View of Commander in Chief's Health  The Wall Street Journal,President's Physical Gives Only Partial View of Commander in Chief's Health  The Wall Street Journal,"{'href': 'https://www.wsj.com', 'title': 'The Wall Street Journal'}"
65e513224390593f61fbae08,Biden's Green Factory Push Is Benefiting Republican States - The Wall Street Journal,https://www.wsj.com/politics/policy/bidens-green-factory-push-is-benefiting-republican-states-1e6e69c4/favicon.ico,[],[],https://www.wsj.com/politics/policy/bidens-green-factory-push-is-benefiting-republican-states-1e6e69c4,2024-02-27,Biden's Green Factory Push Is Benefiting Republican States  The Wall Street Journal,Biden's Green Factory Push Is Benefiting Republican States  The Wall Street Journal,"{'href': 'https://www.wsj.com', 'title': 'The Wall Street Journal'}"
65e513224390593f61fbae18,"With Ukraine Aid Stuck in Congress, Supporters Push Fallback Plans - The Wall Street Journal",https://www.wsj.com/politics/policy/with-ukraine-aid-stuck-in-congress-supporters-push-fallback-plans-82f0c06f/favicon.ico,[],[],https://www.wsj.com/politics/policy/with-ukraine-aid-stuck-in-congress-supporters-push-fallback-plans-82f0c06f,2024-02-21,"With Ukraine Aid Stuck in Congress, Supporters Push Fallback Plans  The Wall Street Journal","With Ukraine Aid Stuck in Congress, Supporters Push Fallback Plans  The Wall Street Journal","{'href': 'https://www.wsj.com', 'title': 'The Wall Street Journal'}"
65e513224390593f61fbae1a,How Nikki Haley—With Help—Made South Carolina an Economic 'Beast of the Southeast' - The Wall Street Journal,https://www.wsj.com/politics/elections/how-nikki-haleywith-helpmade-south-carolina-an-economic-beast-of-the-southeast-4c25290f/favicon.ico,[],[],https://www.wsj.com/politics/elections/how-nikki-haleywith-helpmade-south-carolina-an-economic-beast-of-the-southeast-4c25290f,2024-02-20,How Nikki Haley—With Help—Made South Carolina an Economic 'Beast of the Southeast'  The Wall Street Journal,How Nikki Haley—With Help—Made South Carolina an Economic 'Beast of the Southeast'  The Wall Street Journal,"{'href': 'https://www.wsj.com', 'title': 'The Wall Street Journal'}"
65e513224390593f61fbae2b,White House Confirms Russia Is Developing Antisatellite Weapon - The Wall Street Journal,https://www.wsj.com/politics/national-security/russia-space-weapon-classified-confirmed-b5beacf7/favicon.ico,[],[],https://www.wsj.com/politics/national-security/russia-space-weapon-classified-confirmed-b5beacf7,2024-02-15,White House Confirms Russia Is Developing Antisatellite Weapon  The Wall Street Journal,White House Confirms Russia Is Developing Antisatellite Weapon  The Wall Street Journal,"{'href': 'https://www.wsj.com', 'title': 'The Wall Street Journal'}"
65e513224390593f61fbadef,Lawmakers Reach Deal to Avert Partial Government Shutdown This Weekend - The Wall Street Journal,https://www.wsj.com/politics/policy/speaker-mike-johnson-makes-offer-to-fund-government-avoid-shutdown-48825ef3/favicon.ico,[],[],https://www.wsj.com/politics/policy/speaker-mike-johnson-makes-offer-to-fund-government-avoid-shutdown-48825ef3,2024-02-29,Lawmakers Reach Deal to Avert Partial Government Shutdown This Weekend  The Wall Street Journal,Lawmakers Reach Deal to Avert Partial Government Shutdown This Weekend  The Wall Street Journal,"{'href': 'https://www.wsj.com', 'title': 'The Wall Street Journal'}"
65e513224390593f61fbae16,How Tim Scott Went From 'Faith in America' to Leading Role in Trumpworld - The Wall Street Journal,https://www.wsj.com/politics/elections/how-tim-scott-went-from-faith-in-america-to-leading-role-in-trumpworld-917c8dd0/favicon.ico,[],[],https://www.wsj.com/politics/elections/how-tim-scott-went-from-faith-in-america-to-leading-role-in-trumpworld-917c8dd0,2024-02-22,How Tim Scott Went From 'Faith in America' to Leading Role in Trumpworld  The Wall Street Journal,How Tim Scott Went From 'Faith in America' to Leading Role in Trumpworld  The Wall Street Journal,"{'href': 'https://www.wsj.com', 'title': 'The Wall Street Journal'}"
65e513224390593f61fbae29,McConnell Celebrates Ukraine Win as Trump's Foreign-Policy Shadow Grows - The Wall Street Journal,https://www.wsj.com/politics/policy/mcconnell-celebrates-ukraine-win-as-trumps-foreign-policy-shadow-grows-740a163a/favicon.ico,[],[],https://www.wsj.com/politics/policy/mcconnell-celebrates-ukraine-win-as-trumps-foreign-policy-shadow-grows-740a163a,2024-02-14,McConnell Celebrates Ukraine Win as Trump's Foreign-Policy Shadow Grows  The Wall Street Journal,McConnell Celebrates Ukraine Win as Trump's Foreign-Policy Shadow Grows  The Wall Street Journal,"{'href': 'https://www.wsj.com', 'title': 'The Wall Street Journal'}"
65e513224390593f61fbae2d,Tax-Cut Valentine for Married Couples Falls Short in House - The Wall Street Journal,www.wsj.com/favicon.ico,[],[],https://www.wsj.com/politics/policy/congress-ponders-a-valentine-for-some-high-income-married-couples-6a9442ad,2024-02-14,Tax-Cut Valentine for Married Couples Falls Short in House  The Wall Street Journal,Tax-Cut Valentine for Married Couples Falls Short in House  The Wall Street Journal,"{'href': 'https://www.wsj.com', 'title': 'The Wall Street Journal'}"
65e513224390593f61fbae30,Border Deal to Cut Illegal Immigration Quickly Runs Into Trouble - The Wall Street Journal,https://www.wsj.com/politics/policy/border-deal-to-cut-illegal-immigration-is-released-after-months-of-talks-26a66211/favicon.ico,[],[],https://www.wsj.com/politics/policy/border-deal-to-cut-illegal-immigration-is-released-after-months-of-talks-26a66211,2024-02-04,Border Deal to Cut Illegal Immigration Quickly Runs Into Trouble  The Wall Street Journal,Border Deal to Cut Illegal Immigration Quickly Runs Into Trouble  The Wall Street Journal,"{'href': 'https://www.wsj.com', 'title': 'The Wall Street Journal'}"
65e513224390593f61fbae35,New EPA Air-Pollution Rule Is Another Blow to Coal - WSJ - The Wall Street Journal,https://www.wsj.com/politics/policy/epa-new-pollution-rule-coal-ecd553da/favicon.ico,[],[],https://www.wsj.com/politics/policy/epa-new-pollution-rule-coal-ecd553da,2024-02-08,New EPA Air-Pollution Rule Is Another Blow to Coal - WSJ  The Wall Street Journal,New EPA Air-Pollution Rule Is Another Blow to Coal - WSJ  The Wall Street Journal,"{'href': 'https://www.wsj.com', 'title': 'The Wall Street Journal'}"
65e513224390593f61fbade1,California Homelessness Measure Pits Newsom Against Mental-Health Advocates - The Wall Street Journal,www.wsj.com/favicon.ico,[],[],https://www.wsj.com/politics/elections/california-homelessness-ballot-measure-prop-1-f883e74a,2024-03-03,California Homelessness Measure Pits Newsom Against Mental-Health Advocates  The Wall Street Journal,California Homelessness Measure Pits Newsom Against Mental-Health Advocates  The Wall Street Journal,"{'href': 'https://www.wsj.com', 'title': 'The Wall Street Journal'}"
65e513224390593f61fbadfd,San Francisco Poised to Start Drug-Screening Welfare Recipients - The Wall Street Journal,https://www.wsj.com/politics/policy/san-francisco-drug-testing-welfare-7df699cf/favicon.ico,[],[],https://www.wsj.com/politics/policy/san-francisco-drug-testing-welfare-7df699cf,2024-02-29,San Francisco Poised to Start Drug-Screening Welfare Recipients  The Wall Street Journal,San Francisco Poised to Start Drug-Screening Welfare Recipients  The Wall Street Journal,"{'href': 'https://www.wsj.com', 'title': 'The Wall Street Journal'}"
65e513224390593f61fbae05,Progressive Firebrand Katie Porter Fights to Survive in California Senate Race - The Wall Street Journal,https://www.wsj.com/politics/elections/katie-porter-california-senate-race-191a47fa/favicon.ico,[],[],https://www.wsj.com/politics/elections/katie-porter-california-senate-race-191a47fa,2024-02-28,Progressive Firebrand Katie Porter Fights to Survive in California Senate Race  The Wall Street Journal,Progressive Firebrand Katie Porter Fights to Survive in California Senate Race  The Wall Street Journal,"{'href': 'https://www.wsj.com', 'title': 'The Wall Street Journal'}"
65e513224390593f61fbae0b,Biden's Biggest 2024 Challenge to Date: 'Uncommitted' in Michigan - The Wall Street Journal,https://www.wsj.com/politics/elections/bidens-biggest-2024-challenge-to-date-uncommitted-in-michigan-0eafdb6b/favicon.ico,[],[],https://www.wsj.com/politics/elections/bidens-biggest-2024-challenge-to-date-uncommitted-in-michigan-0eafdb6b,2024-02-26,Biden's Biggest 2024 Challenge to Date: 'Uncommitted' in Michigan  The Wall Street Journal,Biden's Biggest 2024 Challenge to Date: 'Uncommitted' in Michigan  The Wall Street Journal,"{'href': 'https://www.wsj.com', 'title': 'The Wall Street Journal'}"
65e513224390593f61fbae3f,U.S. Drone Strike Kills Iraq Militia Leader Behind Deadly Attack on American Base - The Wall Street Journal,https://www.wsj.com/politics/national-security/u-s-strike-kills-iraq-militia-leader-behind-deadly-drone-attack-on-american-base-d6971744/favicon.ico,[],[],https://www.wsj.com/politics/national-security/u-s-strike-kills-iraq-militia-leader-behind-deadly-drone-attack-on-american-base-d6971744,2024-02-08,U.S. Drone Strike Kills Iraq Militia Leader Behind Deadly Attack on American Base  The Wall Street Journal,U.S. Drone Strike Kills Iraq Militia Leader Behind Deadly Attack on American Base  The Wall Street Journal,"{'href': 'https://www.wsj.com', 'title': 'The Wall Street Journal'}"
65e513224390593f61fbadee,"To Understand Trump's Staying Power With the White Working Class, Look at Michigan - The Wall Street Journal",https://www.wsj.com/politics/elections/to-understand-trumps-staying-power-with-the-white-working-class-look-at-michigan-fced099d/favicon.ico,[],[],https://www.wsj.com/politics/elections/to-understand-trumps-staying-power-with-the-white-working-class-look-at-michigan-fced099d,2024-02-26,"To Understand Trump's Staying Power With the White Working Class, Look at Michigan  The Wall Street Journal","To Understand Trump's Staying Power With the White Working Class, Look at Michigan  The Wall Street Journal","{'href': 'https://www.wsj.com', 'title': 'The Wall Street Journal'}"
65e513224390593f61fbadfe,A Defiant Hunter Biden Rails Against GOP Impeachment Inquiry - The Wall Street Journal,https://www.wsj.com/politics/a-defiant-hunter-biden-rails-against-gop-impeachment-inquiry-8337a15a/favicon.ico,[],[],https://www.wsj.com/politics/a-defiant-hunter-biden-rails-against-gop-impeachment-inquiry-8337a15a,2024-02-28,A Defiant Hunter Biden Rails Against GOP Impeachment Inquiry  The Wall Street Journal,A Defiant Hunter Biden Rails Against GOP Impeachment Inquiry  The Wall Street Journal,"{'href': 'https://www.wsj.com', 'title': 'The Wall Street Journal'}"
65e513224390593f61fbae06,Republicans Confront Political Damage From Alabama IVF Ruling - The Wall Street Journal,https://www.wsj.com/politics/policy/republicans-confront-political-damage-from-alabama-ivf-ruling-f552988f/favicon.ico,[],[],https://www.wsj.com/politics/policy/republicans-confront-political-damage-from-alabama-ivf-ruling-f552988f,2024-02-28,Republicans Confront Political Damage From Alabama IVF Ruling  The Wall Street Journal,Republicans Confront Political Damage From Alabama IVF Ruling  The Wall Street Journal,"{'href': 'https://www.wsj.com', 'title': 'The Wall Street Journal'}"
65e513224390593f61fbae2a,Republican-Led House Impeaches Alejandro Mayorkas on Second Try - The Wall Street Journal,https://www.wsj.com/politics/mayorkas-impeachment-vote-house-1b06dc0d/favicon.ico,[],[],https://www.wsj.com/politics/mayorkas-impeachment-vote-house-1b06dc0d,2024-02-13,Republican-Led House Impeaches Alejandro Mayorkas on Second Try  The Wall Street Journal,Republican-Led House Impeaches Alejandro Mayorkas on Second Try  The Wall Street Journal,"{'href': 'https://www.wsj.com', 'title': 'The Wall Street Journal'}"
65e513224390593f61fbae31,Larry Hogan's Senate Run Adds to Democrats' 2024 Worries - The Wall Street Journal,www.wsj.com/favicon.ico,[],[],https://www.wsj.com/politics/elections/anti-trump-republican-larry-hogan-runs-for-senate-in-maryland-79e337f1,2024-02-09,Larry Hogan's Senate Run Adds to Democrats' 2024 Worries  The Wall Street Journal,Larry Hogan's Senate Run Adds to Democrats' 2024 Worries  The Wall Street Journal,"{'href': 'https://www.wsj.com', 'title': 'The Wall Street Journal'}"
65e513224390593f61fbae34,This Lawmaker Endorsed DeSantis Over Trump. Will He Regret It? - The Wall Street Journal,www.wsj.com/favicon.ico,[],[],https://www.wsj.com/politics/elections/this-lawmaker-endorsed-desantis-over-trump-will-he-regret-it-72d85f1d,2024-02-05,This Lawmaker Endorsed DeSantis Over Trump. Will He Regret It?  The Wall Street Journal,This Lawmaker Endorsed DeSantis Over Trump. Will He Regret It?  The Wall Street Journal,"{'href': 'https://www.wsj.com', 'title': 'The Wall Street Journal'}"
65e513224390593f61fbadec,Hunter Biden's Chinese Business Partners Keep Quiet in Impeachment Effort - The Wall Street Journal,https://www.wsj.com/politics/hunter-bidens-chinese-business-partners-keep-quiet-in-impeachment-effort-5062ca44/favicon.ico,[],[],https://www.wsj.com/politics/hunter-bidens-chinese-business-partners-keep-quiet-in-impeachment-effort-5062ca44,2024-02-28,Hunter Biden's Chinese Business Partners Keep Quiet in Impeachment Effort  The Wall Street Journal,Hunter Biden's Chinese Business Partners Keep Quiet in Impeachment Effort  The Wall Street Journal,"{'href': 'https://www.wsj.com', 'title': 'The Wall Street Journal'}"
65e513224390593f61fbadf3,Where IVF Treatment Faces Threats From Personhood Bills - The Wall Street Journal,https://www.wsj.com/politics/policy/ivf-embryo-personhood-abortion-bills-rulings-7ed8b0f8/favicon.ico,[],[],https://www.wsj.com/politics/policy/ivf-embryo-personhood-abortion-bills-rulings-7ed8b0f8,2024-03-01,Where IVF Treatment Faces Threats From Personhood Bills  The Wall Street Journal,Where IVF Treatment Faces Threats From Personhood Bills  The Wall Street Journal,"{'href': 'https://www.wsj.com', 'title': 'The Wall Street Journal'}"
65e513224390593f61fbae10,"Trump, Republican Lawmakers Forced to Defend IVF as GOP Abortion Woes Mount - The Wall Street Journal",https://www.wsj.com/politics/policy/trump-republican-lawmakers-forced-to-defend-ivf-as-gop-abortion-woes-mount-55729386/favicon.ico,[],[],https://www.wsj.com/politics/policy/trump-republican-lawmakers-forced-to-defend-ivf-as-gop-abortion-woes-mount-55729386,2024-02-23,"Trump, Republican Lawmakers Forced to Defend IVF as GOP Abortion Woes Mount  The Wall Street Journal","Trump, Republican Lawmakers Forced to Defend IVF as GOP Abortion Woes Mount  The Wall Street Journal","{'href': 'https://www.wsj.com', 'title': 'The Wall Street Journal'}"
65e513224390593f61fbae25,Pentagon Used Six-Bladed 'Ginsu' Weapon to Kill Iraqi Militia Leader - WSJ - The Wall Street Journal,https://www.wsj.com/politics/national-security/pentagon-used-six-bladed-ginsu-weapon-to-kill-iraqi-militia-leader-7dfe0687/favicon.ico,[],[],https://www.wsj.com/politics/national-security/pentagon-used-six-bladed-ginsu-weapon-to-kill-iraqi-militia-leader-7dfe0687,2024-02-14,Pentagon Used Six-Bladed 'Ginsu' Weapon to Kill Iraqi Militia Leader - WSJ  The Wall Street Journal,Pentagon Used Six-Bladed 'Ginsu' Weapon to Kill Iraqi Militia Leader - WSJ  The Wall Street Journal,"{'href': 'https://www.wsj.com', 'title': 'The Wall Street Journal'}"
65e513224390593f61fbae2f,FBI Director Says China Cyberattacks on U.S. Infrastructure Now at Unprecedented Scale - The Wall Street Journal,https://www.wsj.com/politics/national-security/fbi-director-says-china-cyberattacks-on-u-s-infrastructure-now-at-unprecedented-scale-c8de5983/favicon.ico,[],[],https://www.wsj.com/politics/national-security/fbi-director-says-china-cyberattacks-on-u-s-infrastructure-now-at-unprecedented-scale-c8de5983,2024-02-18,FBI Director Says China Cyberattacks on U.S. Infrastructure Now at Unprecedented Scale  The Wall Street Journal,FBI Director Says China Cyberattacks on U.S. Infrastructure Now at Unprecedented Scale  The Wall Street Journal,"{'href': 'https://www.wsj.com', 'title': 'The Wall Street Journal'}"
65e513224390593f61fbadf1,Donald Trump Continues March Toward GOP Nomination With Michigan Win - The Wall Street Journal,https://www.wsj.com/politics/elections/nikki-haley-is-defiant-ahead-of-expected-loss-in-michigan-primary-ed98ea50/favicon.ico,[],[],https://www.wsj.com/politics/elections/nikki-haley-is-defiant-ahead-of-expected-loss-in-michigan-primary-ed98ea50,2024-02-28,Donald Trump Continues March Toward GOP Nomination With Michigan Win  The Wall Street Journal,Donald Trump Continues March Toward GOP Nomination With Michigan Win  The Wall Street Journal,"{'href': 'https://www.wsj.com', 'title': 'The Wall Street Journal'}"
65e513224390593f61fbadf5,"Tax Deal Stalls in Senate, Imperiling Breaks for Businesses and Families - The Wall Street Journal",https://www.wsj.com/politics/policy/tax-deal-stalls-in-senate-imperiling-breaks-for-businesses-and-families-88f5238e/favicon.ico,[],[],https://www.wsj.com/politics/policy/tax-deal-stalls-in-senate-imperiling-breaks-for-businesses-and-families-88f5238e,2024-03-01,"Tax Deal Stalls in Senate, Imperiling Breaks for Businesses and Families  The Wall Street Journal","Tax Deal Stalls in Senate, Imperiling Breaks for Businesses and Families  The Wall Street Journal","{'href': 'https://www.wsj.com', 'title': 'The Wall Street Journal'}"
65e513224390593f61fbadff,"U.S. Limits Sales of Americans' Personal Data to China, Other Adversaries - The Wall Street Journal",https://www.wsj.com/politics/national-security/u-s-to-limit-sales-of-americans-personal-data-to-china-other-adversaries-e82a3ca5/favicon.ico,[],[],https://www.wsj.com/politics/national-security/u-s-to-limit-sales-of-americans-personal-data-to-china-other-adversaries-e82a3ca5,2024-02-29,"U.S. Limits Sales of Americans' Personal Data to China, Other Adversaries  The Wall Street Journal","U.S. Limits Sales of Americans' Personal Data to China, Other Adversaries  The Wall Street Journal","{'href': 'https://www.wsj.com', 'title': 'The Wall Street Journal'}"
65e513224390593f61fbae23,Donald Trump Courts Sneakerheads With $399 Gilded High-Tops - The Wall Street Journal,https://www.wsj.com/politics/elections/donald-trump-courts-sneakerheads-with-399-gilded-high-tops-ea2e334c/favicon.ico,[],[],https://www.wsj.com/politics/elections/donald-trump-courts-sneakerheads-with-399-gilded-high-tops-ea2e334c,2024-02-17,Donald Trump Courts Sneakerheads With $399 Gilded High-Tops  The Wall Street Journal,Donald Trump Courts Sneakerheads With $399 Gilded High-Tops  The Wall Street Journal,"{'href': 'https://www.wsj.com', 'title': 'The Wall Street Journal'}"
