_id,title,top_image,images,videos,url,date,short_description,text,publisher
65e6675ef96774f41ee110e1,Tax-Cut Valentine for Married Couples Falls Short in House - The Wall Street Journal,https://www.wsj.com/politics/policy/congress-ponders-a-valentine-for-some-high-income-married-couples-6a9442ad/favicon.ico,[],[],https://www.wsj.com/politics/policy/congress-ponders-a-valentine-for-some-high-income-married-couples-6a9442ad,2024-02-14,Tax-Cut Valentine for Married Couples Falls Short in House  The Wall Street Journal,Tax-Cut Valentine for Married Couples Falls Short in House  The Wall Street Journal,"{'href': 'https://www.wsj.com', 'title': 'The Wall Street Journal'}"
65e6675ef96774f41ee110e9,Biden Classified Document Probe: Five Revelations From the Special Counsel's Report - WSJ - The Wall Street Journal,https://www.wsj.com/politics/national-security/joe-biden-classified-document-case-revelations-3db06ca6/favicon.ico,[],[],https://www.wsj.com/politics/national-security/joe-biden-classified-document-case-revelations-3db06ca6,2024-02-09,Biden Classified Document Probe: Five Revelations From the Special Counsel's Report - WSJ  The Wall Street Journal,Biden Classified Document Probe: Five Revelations From the Special Counsel's Report - WSJ  The Wall Street Journal,"{'href': 'https://www.wsj.com', 'title': 'The Wall Street Journal'}"
65e6675ef96774f41ee11095,Mitch McConnell Couldn't Fend Off Trump's Populist Takeover - The Wall Street Journal,https://www.wsj.com/politics/elections/mitch-mcconnell-couldnt-fend-off-trumps-populist-takeover-4b8d2ecb/favicon.ico,[],[],https://www.wsj.com/politics/elections/mitch-mcconnell-couldnt-fend-off-trumps-populist-takeover-4b8d2ecb,2024-03-02,Mitch McConnell Couldn't Fend Off Trump's Populist Takeover  The Wall Street Journal,Mitch McConnell Couldn't Fend Off Trump's Populist Takeover  The Wall Street Journal,"{'href': 'https://www.wsj.com', 'title': 'The Wall Street Journal'}"
65e6675ef96774f41ee11096,U.S. to Deliver Aid to Gaza Through Military Airdrops - The Wall Street Journal,https://www.wsj.com/politics/national-security/u-s-expected-to-deliver-aid-to-gaza-through-military-air-drops-79814c51/favicon.ico,[],[],https://www.wsj.com/politics/national-security/u-s-expected-to-deliver-aid-to-gaza-through-military-air-drops-79814c51,2024-03-01,U.S. to Deliver Aid to Gaza Through Military Airdrops  The Wall Street Journal,U.S. to Deliver Aid to Gaza Through Military Airdrops  The Wall Street Journal,"{'href': 'https://www.wsj.com', 'title': 'The Wall Street Journal'}"
65e6675ef96774f41ee1109c,Oregon Decriminalized Hard Drugs. Now It's Reversing Course. - The Wall Street Journal,https://www.wsj.com/politics/policy/oregon-drug-law-hard-drugs-criminal-2030d040/favicon.ico,[],[],https://www.wsj.com/politics/policy/oregon-drug-law-hard-drugs-criminal-2030d040,2024-03-02,Oregon Decriminalized Hard Drugs. Now It's Reversing Course.  The Wall Street Journal,Oregon Decriminalized Hard Drugs. Now It's Reversing Course.  The Wall Street Journal,"{'href': 'https://www.wsj.com', 'title': 'The Wall Street Journal'}"
65e6675ef96774f41ee110ec,Nikki Haley Doesn't Care if Extended GOP Race Damages Trump - WSJ - The Wall Street Journal,https://www.wsj.com/politics/elections/nikki-haley-doesnt-care-if-extended-gop-race-damages-trump-060c0a01/favicon.ico,[],[],https://www.wsj.com/politics/elections/nikki-haley-doesnt-care-if-extended-gop-race-damages-trump-060c0a01,2024-02-09,Nikki Haley Doesn't Care if Extended GOP Race Damages Trump - WSJ  The Wall Street Journal,Nikki Haley Doesn't Care if Extended GOP Race Damages Trump - WSJ  The Wall Street Journal,"{'href': 'https://www.wsj.com', 'title': 'The Wall Street Journal'}"
65e6675ef96774f41ee11091,"Voters Are More Upbeat on Economy, but Biden Gets Little Benefit, WSJ Poll Shows - WSJ - The Wall Street Journal",https://www.wsj.com/politics/elections/voters-are-more-upbeat-on-economy-but-biden-gets-little-benefit-wsj-poll-shows-8e608db8/favicon.ico,[],[],https://www.wsj.com/politics/elections/voters-are-more-upbeat-on-economy-but-biden-gets-little-benefit-wsj-poll-shows-8e608db8,2024-03-03,"Voters Are More Upbeat on Economy, but Biden Gets Little Benefit, WSJ Poll Shows - WSJ  The Wall Street Journal","Voters Are More Upbeat on Economy, but Biden Gets Little Benefit, WSJ Poll Shows - WSJ  The Wall Street Journal","{'href': 'https://www.wsj.com', 'title': 'The Wall Street Journal'}"
65e6675ef96774f41ee11099,The Challenge for Mitch McConnell's Successor: Bringing In the Big Money - The Wall Street Journal,https://www.wsj.com/politics/elections/the-challenge-for-mitch-mcconnells-successor-bringing-in-the-big-money-bdd6d99b/favicon.ico,[],[],https://www.wsj.com/politics/elections/the-challenge-for-mitch-mcconnells-successor-bringing-in-the-big-money-bdd6d99b,2024-03-04,The Challenge for Mitch McConnell's Successor: Bringing In the Big Money  The Wall Street Journal,The Challenge for Mitch McConnell's Successor: Bringing In the Big Money  The Wall Street Journal,"{'href': 'https://www.wsj.com', 'title': 'The Wall Street Journal'}"
65e6675ef96774f41ee110a9,U.S. Politics - WSJ.com - The Wall Street Journal,www.wsj.com/favicon.ico,[],[],https://www.wsj.com/politics,2017-11-11,U.S. Politics - WSJ.com  The Wall Street Journal,U.S. Politics - WSJ.com  The Wall Street Journal,"{'href': 'https://www.wsj.com', 'title': 'The Wall Street Journal'}"
65e6675ef96774f41ee110b1,Progressive Firebrand Katie Porter Fights to Survive in California Senate Race - The Wall Street Journal,https://www.wsj.com/politics/elections/katie-porter-california-senate-race-191a47fa/favicon.ico,[],[],https://www.wsj.com/politics/elections/katie-porter-california-senate-race-191a47fa,2024-02-28,Progressive Firebrand Katie Porter Fights to Survive in California Senate Race  The Wall Street Journal,Progressive Firebrand Katie Porter Fights to Survive in California Senate Race  The Wall Street Journal,"{'href': 'https://www.wsj.com', 'title': 'The Wall Street Journal'}"
65e6675ef96774f41ee110b5,Republicans Confront Political Damage From Alabama IVF Ruling - The Wall Street Journal,https://www.wsj.com/politics/policy/republicans-confront-political-damage-from-alabama-ivf-ruling-f552988f/favicon.ico,[],[],https://www.wsj.com/politics/policy/republicans-confront-political-damage-from-alabama-ivf-ruling-f552988f,2024-02-28,Republicans Confront Political Damage From Alabama IVF Ruling  The Wall Street Journal,Republicans Confront Political Damage From Alabama IVF Ruling  The Wall Street Journal,"{'href': 'https://www.wsj.com', 'title': 'The Wall Street Journal'}"
65e6675ef96774f41ee110bb,"With Pressure Growing After IVF Pause, Alabama GOP Rushes to Pass Protections - The Wall Street Journal",https://www.wsj.com/politics/alabama-ivf-gop-rushes-to-pass-protections-be65fa9c/favicon.ico,[],[],https://www.wsj.com/politics/alabama-ivf-gop-rushes-to-pass-protections-be65fa9c,2024-02-27,"With Pressure Growing After IVF Pause, Alabama GOP Rushes to Pass Protections  The Wall Street Journal","With Pressure Growing After IVF Pause, Alabama GOP Rushes to Pass Protections  The Wall Street Journal","{'href': 'https://www.wsj.com', 'title': 'The Wall Street Journal'}"
65e6675ef96774f41ee110cb,Donors Keep Pouring Millions Into Nikki Haley's Long-Shot Campaign - The Wall Street Journal,https://www.wsj.com/politics/elections/biden-campaign-reports-42-million-in-january-fundraising-8e477187/favicon.ico,[],[],https://www.wsj.com/politics/elections/biden-campaign-reports-42-million-in-january-fundraising-8e477187,2024-02-21,Donors Keep Pouring Millions Into Nikki Haley's Long-Shot Campaign  The Wall Street Journal,Donors Keep Pouring Millions Into Nikki Haley's Long-Shot Campaign  The Wall Street Journal,"{'href': 'https://www.wsj.com', 'title': 'The Wall Street Journal'}"
65e6675ef96774f41ee110df,White House Confirms Russia Is Developing Antisatellite Weapon - The Wall Street Journal,https://www.wsj.com/politics/national-security/russia-space-weapon-classified-confirmed-b5beacf7/favicon.ico,[],[],https://www.wsj.com/politics/national-security/russia-space-weapon-classified-confirmed-b5beacf7,2024-02-15,White House Confirms Russia Is Developing Antisatellite Weapon  The Wall Street Journal,White House Confirms Russia Is Developing Antisatellite Weapon  The Wall Street Journal,"{'href': 'https://www.wsj.com', 'title': 'The Wall Street Journal'}"
65e6675ef96774f41ee110a6,Congress Passes Bill to Avert Government Shutdown - The Wall Street Journal,https://www.wsj.com/politics/policy/house-to-vote-on-bill-averting-shutdown-over-some-republicans-complaints-c6d7135d/favicon.ico,[],[],https://www.wsj.com/politics/policy/house-to-vote-on-bill-averting-shutdown-over-some-republicans-complaints-c6d7135d,2024-03-01,Congress Passes Bill to Avert Government Shutdown  The Wall Street Journal,Congress Passes Bill to Avert Government Shutdown  The Wall Street Journal,"{'href': 'https://www.wsj.com', 'title': 'The Wall Street Journal'}"
65e6675ef96774f41ee110c1,The Challenge to U.S. Leadership on Ukraine Comes From Home - The Wall Street Journal,https://www.wsj.com/politics/national-security/the-challenge-to-u-s-leadership-on-ukraine-comes-from-home-93c357ac/favicon.ico,[],[],https://www.wsj.com/politics/national-security/the-challenge-to-u-s-leadership-on-ukraine-comes-from-home-93c357ac,2024-02-25,The Challenge to U.S. Leadership on Ukraine Comes From Home  The Wall Street Journal,The Challenge to U.S. Leadership on Ukraine Comes From Home  The Wall Street Journal,"{'href': 'https://www.wsj.com', 'title': 'The Wall Street Journal'}"
65e6675ef96774f41ee11090,Courts Pummeled Trump. That Made Some Republicans Love Him More. - The Wall Street Journal,www.wsj.com/favicon.ico,[],[],https://www.wsj.com/politics/elections/donald-trump-north-carolina-super-tuesday-9799831b,2024-03-04,Courts Pummeled Trump. That Made Some Republicans Love Him More.  The Wall Street Journal,Courts Pummeled Trump. That Made Some Republicans Love Him More.  The Wall Street Journal,"{'href': 'https://www.wsj.com', 'title': 'The Wall Street Journal'}"
65e6675ef96774f41ee110c0,"Trump Tightens Hold on GOP, Crowding Out Even Popular Rivals - The Wall Street Journal",https://www.wsj.com/politics/elections/trump-tightens-hold-on-gop-crowding-out-even-popular-rivals-93810b3a/favicon.ico,[],[],https://www.wsj.com/politics/elections/trump-tightens-hold-on-gop-crowding-out-even-popular-rivals-93810b3a,2024-02-26,"Trump Tightens Hold on GOP, Crowding Out Even Popular Rivals  The Wall Street Journal","Trump Tightens Hold on GOP, Crowding Out Even Popular Rivals  The Wall Street Journal","{'href': 'https://www.wsj.com', 'title': 'The Wall Street Journal'}"
65e6675ef96774f41ee110c9,"With Ukraine Aid Stuck in Congress, Supporters Push Fallback Plans - The Wall Street Journal",https://www.wsj.com/politics/policy/with-ukraine-aid-stuck-in-congress-supporters-push-fallback-plans-82f0c06f/favicon.ico,[],[],https://www.wsj.com/politics/policy/with-ukraine-aid-stuck-in-congress-supporters-push-fallback-plans-82f0c06f,2024-02-21,"With Ukraine Aid Stuck in Congress, Supporters Push Fallback Plans  The Wall Street Journal","With Ukraine Aid Stuck in Congress, Supporters Push Fallback Plans  The Wall Street Journal","{'href': 'https://www.wsj.com', 'title': 'The Wall Street Journal'}"
65e6675ef96774f41ee110cd,Congress Isn't Going to Fix the Border. Can Biden? - The Wall Street Journal,https://www.wsj.com/politics/policy/congress-isnt-going-to-fix-the-border-can-biden-8e819275/favicon.ico,[],[],https://www.wsj.com/politics/policy/congress-isnt-going-to-fix-the-border-can-biden-8e819275,2024-02-14,Congress Isn't Going to Fix the Border. Can Biden?  The Wall Street Journal,Congress Isn't Going to Fix the Border. Can Biden?  The Wall Street Journal,"{'href': 'https://www.wsj.com', 'title': 'The Wall Street Journal'}"
65e6675ef96774f41ee110e0,Rep. Jim Clyburn Will Step Down From Democratic Leadership - The Wall Street Journal,https://www.wsj.com/politics/rep-jim-clyburn-will-step-down-from-democratic-leadership-549f7530/favicon.ico,[],[],https://www.wsj.com/politics/rep-jim-clyburn-will-step-down-from-democratic-leadership-549f7530,2024-02-14,Rep. Jim Clyburn Will Step Down From Democratic Leadership  The Wall Street Journal,Rep. Jim Clyburn Will Step Down From Democratic Leadership  The Wall Street Journal,"{'href': 'https://www.wsj.com', 'title': 'The Wall Street Journal'}"
65e6675ef96774f41ee110e6,This Lawmaker Endorsed DeSantis Over Trump. Will He Regret It? - The Wall Street Journal,https://www.wsj.com/politics/elections/this-lawmaker-endorsed-desantis-over-trump-will-he-regret-it-72d85f1d/favicon.ico,[],[],https://www.wsj.com/politics/elections/this-lawmaker-endorsed-desantis-over-trump-will-he-regret-it-72d85f1d,2024-02-05,This Lawmaker Endorsed DeSantis Over Trump. Will He Regret It?  The Wall Street Journal,This Lawmaker Endorsed DeSantis Over Trump. Will He Regret It?  The Wall Street Journal,"{'href': 'https://www.wsj.com', 'title': 'The Wall Street Journal'}"
65e6675ef96774f41ee110ea,The Deficit Could Shrink This Year. America Still Has a Serious Budget Problem. - The Wall Street Journal,https://www.wsj.com/politics/policy/the-deficit-could-shrink-this-year-america-still-has-a-serious-budget-problem-60ea804e/favicon.ico,[],[],https://www.wsj.com/politics/policy/the-deficit-could-shrink-this-year-america-still-has-a-serious-budget-problem-60ea804e,2024-02-07,The Deficit Could Shrink This Year. America Still Has a Serious Budget Problem.  The Wall Street Journal,The Deficit Could Shrink This Year. America Still Has a Serious Budget Problem.  The Wall Street Journal,"{'href': 'https://www.wsj.com', 'title': 'The Wall Street Journal'}"
65e6675ef96774f41ee11093,"WSJ News Exclusive | U.S. Voter Sympathy for Palestinians Grows, WSJ Poll Finds - The Wall Street Journal",https://www.wsj.com/politics/u-s-voter-sympathy-for-palestinians-grows-as-israel-war-drags-on-wsj-poll-finds-e515aab9/favicon.ico,[],[],https://www.wsj.com/politics/u-s-voter-sympathy-for-palestinians-grows-as-israel-war-drags-on-wsj-poll-finds-e515aab9,2024-03-03,"WSJ News Exclusive | U.S. Voter Sympathy for Palestinians Grows, WSJ Poll Finds  The Wall Street Journal","WSJ News Exclusive | U.S. Voter Sympathy for Palestinians Grows, WSJ Poll Finds  The Wall Street Journal","{'href': 'https://www.wsj.com', 'title': 'The Wall Street Journal'}"
65e6675ef96774f41ee1109e,"Biden Wins Michigan Democratic Primary, With 'Uncommitted' in Second Place - The Wall Street Journal",https://www.wsj.com/politics/elections/in-michigan-primary-uncommitted-is-a-protest-vote-22915829/favicon.ico,[],[],https://www.wsj.com/politics/elections/in-michigan-primary-uncommitted-is-a-protest-vote-22915829,2024-02-28,"Biden Wins Michigan Democratic Primary, With 'Uncommitted' in Second Place  The Wall Street Journal","Biden Wins Michigan Democratic Primary, With 'Uncommitted' in Second Place  The Wall Street Journal","{'href': 'https://www.wsj.com', 'title': 'The Wall Street Journal'}"
65e6675ef96774f41ee110d0,John Kerry Is Stepping Down as Climate Envoy at Age 80. He Isn't Going Quietly. - The Wall Street Journal,www.wsj.com/favicon.ico,[],[],https://www.wsj.com/politics/policy/john-kerry-is-stepping-down-as-climate-envoy-at-age-80-he-isnt-going-quietly-1bfe7444?st=3s3ze0lzi8rjkte&mod=googlenewsfeed,2024-03-04,John Kerry Is Stepping Down as Climate Envoy at Age 80. He Isn't Going Quietly.  The Wall Street Journal,John Kerry Is Stepping Down as Climate Envoy at Age 80. He Isn't Going Quietly.  The Wall Street Journal,"{'href': 'https://www.wsj.com', 'title': 'The Wall Street Journal'}"
65e6675ef96774f41ee1108f,John Kerry Is Stepping Down as Climate Envoy at Age 80. He Isn't Going Quietly. - The Wall Street Journal,www.wsj.com/favicon.ico,[],[],https://www.wsj.com/politics/policy/john-kerry-is-stepping-down-as-climate-envoy-at-age-80-he-isnt-going-quietly-1bfe7444,2024-03-04,John Kerry Is Stepping Down as Climate Envoy at Age 80. He Isn't Going Quietly.  The Wall Street Journal,John Kerry Is Stepping Down as Climate Envoy at Age 80. He Isn't Going Quietly.  The Wall Street Journal,"{'href': 'https://www.wsj.com', 'title': 'The Wall Street Journal'}"
65e6675ef96774f41ee1109b,"To Understand Trump's Staying Power With the White Working Class, Look at Michigan - The Wall Street Journal",https://www.wsj.com/politics/elections/to-understand-trumps-staying-power-with-the-white-working-class-look-at-michigan-fced099d/favicon.ico,[],[],https://www.wsj.com/politics/elections/to-understand-trumps-staying-power-with-the-white-working-class-look-at-michigan-fced099d,2024-02-25,"To Understand Trump's Staying Power With the White Working Class, Look at Michigan  The Wall Street Journal","To Understand Trump's Staying Power With the White Working Class, Look at Michigan  The Wall Street Journal","{'href': 'https://www.wsj.com', 'title': 'The Wall Street Journal'}"
65e6675ef96774f41ee110ab,No Labels to Make Decision Next Week Whether to Back 'Unity' Ticket - The Wall Street Journal,https://www.wsj.com/politics/no-labels-to-make-decision-next-week-whether-to-back-unity-ticket-344a95dd/favicon.ico,[],[],https://www.wsj.com/politics/no-labels-to-make-decision-next-week-whether-to-back-unity-ticket-344a95dd,2024-02-29,No Labels to Make Decision Next Week Whether to Back 'Unity' Ticket  The Wall Street Journal,No Labels to Make Decision Next Week Whether to Back 'Unity' Ticket  The Wall Street Journal,"{'href': 'https://www.wsj.com', 'title': 'The Wall Street Journal'}"
65e6675ef96774f41ee110ae,President's Physical Gives Only Partial View of Commander in Chief's Health - The Wall Street Journal,https://www.wsj.com/politics/presidents-physical-offers-only-partial-window-into-the-health-of-commander-in-chief-ffe653ed/favicon.ico,[],[],https://www.wsj.com/politics/presidents-physical-offers-only-partial-window-into-the-health-of-commander-in-chief-ffe653ed,2024-02-28,President's Physical Gives Only Partial View of Commander in Chief's Health  The Wall Street Journal,President's Physical Gives Only Partial View of Commander in Chief's Health  The Wall Street Journal,"{'href': 'https://www.wsj.com', 'title': 'The Wall Street Journal'}"
65e6675ef96774f41ee110af,Michigan Wins Carry Warning Signs for Biden and Trump - The Wall Street Journal,https://www.wsj.com/politics/elections/michigan-primary-results-trump-biden-outlook-255d5013/favicon.ico,[],[],https://www.wsj.com/politics/elections/michigan-primary-results-trump-biden-outlook-255d5013,2024-02-28,Michigan Wins Carry Warning Signs for Biden and Trump  The Wall Street Journal,Michigan Wins Carry Warning Signs for Biden and Trump  The Wall Street Journal,"{'href': 'https://www.wsj.com', 'title': 'The Wall Street Journal'}"
65e6675ef96774f41ee110c4,Blue-State Residents Streamed Into South Carolina. Here's Why It Stayed Ruby Red. - The Wall Street Journal,www.wsj.com/favicon.ico,[],[],https://www.wsj.com/politics/elections/blue-state-residents-streamed-into-south-carolina-heres-why-it-stayed-ruby-red-a049c74c,2024-02-23,Blue-State Residents Streamed Into South Carolina. Here's Why It Stayed Ruby Red.  The Wall Street Journal,Blue-State Residents Streamed Into South Carolina. Here's Why It Stayed Ruby Red.  The Wall Street Journal,"{'href': 'https://www.wsj.com', 'title': 'The Wall Street Journal'}"
65e6675ef96774f41ee110c8,How Tim Scott Went From 'Faith in America' to Leading Role in Trumpworld - The Wall Street Journal,https://www.wsj.com/politics/elections/how-tim-scott-went-from-faith-in-america-to-leading-role-in-trumpworld-917c8dd0/favicon.ico,[],[],https://www.wsj.com/politics/elections/how-tim-scott-went-from-faith-in-america-to-leading-role-in-trumpworld-917c8dd0,2024-02-22,How Tim Scott Went From 'Faith in America' to Leading Role in Trumpworld  The Wall Street Journal,How Tim Scott Went From 'Faith in America' to Leading Role in Trumpworld  The Wall Street Journal,"{'href': 'https://www.wsj.com', 'title': 'The Wall Street Journal'}"
65e6675ef96774f41ee110cf,Mike Johnson's Chaotic House Searches for Path on Ukraine - The Wall Street Journal,https://www.wsj.com/politics/policy/mike-johnsons-chaotic-house-searches-for-path-on-ukraine-9b84cd7a/favicon.ico,[],[],https://www.wsj.com/politics/policy/mike-johnsons-chaotic-house-searches-for-path-on-ukraine-9b84cd7a,2024-02-16,Mike Johnson's Chaotic House Searches for Path on Ukraine  The Wall Street Journal,Mike Johnson's Chaotic House Searches for Path on Ukraine  The Wall Street Journal,"{'href': 'https://www.wsj.com', 'title': 'The Wall Street Journal'}"
65e6675ef96774f41ee110d1,Haley Slams Trump for Silence on Navalny - The Wall Street Journal,https://www.wsj.com/politics/policy/haley-hits-trump-for-silence-on-navalny-d831787f/favicon.ico,[],[],https://www.wsj.com/politics/policy/haley-hits-trump-for-silence-on-navalny-d831787f,2024-02-19,Haley Slams Trump for Silence on Navalny  The Wall Street Journal,Haley Slams Trump for Silence on Navalny  The Wall Street Journal,"{'href': 'https://www.wsj.com', 'title': 'The Wall Street Journal'}"
65e6675ef96774f41ee110da,FBI Director Says China Cyberattacks on U.S. Infrastructure Now at Unprecedented Scale - The Wall Street Journal,https://www.wsj.com/politics/national-security/fbi-director-says-china-cyberattacks-on-u-s-infrastructure-now-at-unprecedented-scale-c8de5983/favicon.ico,[],[],https://www.wsj.com/politics/national-security/fbi-director-says-china-cyberattacks-on-u-s-infrastructure-now-at-unprecedented-scale-c8de5983,2024-02-18,FBI Director Says China Cyberattacks on U.S. Infrastructure Now at Unprecedented Scale  The Wall Street Journal,FBI Director Says China Cyberattacks on U.S. Infrastructure Now at Unprecedented Scale  The Wall Street Journal,"{'href': 'https://www.wsj.com', 'title': 'The Wall Street Journal'}"
65e6675ef96774f41ee110e3,Border Deal to Cut Illegal Immigration Quickly Runs Into Trouble - The Wall Street Journal,https://www.wsj.com/politics/policy/border-deal-to-cut-illegal-immigration-is-released-after-months-of-talks-26a66211/favicon.ico,[],[],https://www.wsj.com/politics/policy/border-deal-to-cut-illegal-immigration-is-released-after-months-of-talks-26a66211,2024-02-04,Border Deal to Cut Illegal Immigration Quickly Runs Into Trouble  The Wall Street Journal,Border Deal to Cut Illegal Immigration Quickly Runs Into Trouble  The Wall Street Journal,"{'href': 'https://www.wsj.com', 'title': 'The Wall Street Journal'}"
65e6675ef96774f41ee110f0,Nikki Haley Asks for Secret Service Protection After Increase in Threats - The Wall Street Journal,https://www.wsj.com/politics/elections/nikki-haley-asks-for-secret-service-protection-after-increase-in-threats-05b67a22/favicon.ico,[],[],https://www.wsj.com/politics/elections/nikki-haley-asks-for-secret-service-protection-after-increase-in-threats-05b67a22,2024-02-05,Nikki Haley Asks for Secret Service Protection After Increase in Threats  The Wall Street Journal,Nikki Haley Asks for Secret Service Protection After Increase in Threats  The Wall Street Journal,"{'href': 'https://www.wsj.com', 'title': 'The Wall Street Journal'}"
65e6675ef96774f41ee1109a,What Nikki Haley Is Really Doing - WSJ - The Wall Street Journal,https://www.wsj.com/politics/elections/what-nikki-haley-is-really-doing-6115dc4e/favicon.ico,[],[],https://www.wsj.com/politics/elections/what-nikki-haley-is-really-doing-6115dc4e,2024-02-26,What Nikki Haley Is Really Doing - WSJ  The Wall Street Journal,What Nikki Haley Is Really Doing - WSJ  The Wall Street Journal,"{'href': 'https://www.wsj.com', 'title': 'The Wall Street Journal'}"
65e6675ef96774f41ee110d5,Mitch McConnell to Step Down as Senate Minority Leader in November - The Wall Street Journal,www.wsj.com/favicon.ico,[],[],https://www.wsj.com/politics/policy/mitch-mcconnell-to-step-down-as-senate-minority-leader-in-november-7e9ca478?mod=europe_whatsnews_pos1,2024-02-28,Mitch McConnell to Step Down as Senate Minority Leader in November  The Wall Street Journal,Mitch McConnell to Step Down as Senate Minority Leader in November  The Wall Street Journal,"{'href': 'https://www.wsj.com', 'title': 'The Wall Street Journal'}"
65e6675ef96774f41ee110d8,A Defiant Hunter Biden Rails Against GOP Impeachment Inquiry - The Wall Street Journal,https://www.wsj.com/politics/a-defiant-hunter-biden-rails-against-gop-impeachment-inquiry-8337a15a/favicon.ico,[],[],https://www.wsj.com/politics/a-defiant-hunter-biden-rails-against-gop-impeachment-inquiry-8337a15a,2024-02-28,A Defiant Hunter Biden Rails Against GOP Impeachment Inquiry  The Wall Street Journal,A Defiant Hunter Biden Rails Against GOP Impeachment Inquiry  The Wall Street Journal,"{'href': 'https://www.wsj.com', 'title': 'The Wall Street Journal'}"
65e6675ef96774f41ee11097,Essay | Border Crackdowns Won't Solve America's Immigration Crisis - The Wall Street Journal,https://www.wsj.com/politics/policy/border-crackdowns-wont-solve-americas-immigration-crisis-f21b0c4b/favicon.ico,[],[],https://www.wsj.com/politics/policy/border-crackdowns-wont-solve-americas-immigration-crisis-f21b0c4b,2024-03-01,Essay | Border Crackdowns Won't Solve America's Immigration Crisis  The Wall Street Journal,Essay | Border Crackdowns Won't Solve America's Immigration Crisis  The Wall Street Journal,"{'href': 'https://www.wsj.com', 'title': 'The Wall Street Journal'}"
